Course Number,Course Title,Credits,Description,Offered Term,Liberal Arts Requirements,Tags,Prerequisites,Faculty,Meeting Day,Location,Time,Unnamed: 12
POSC 272,Constitutional Law II,6 credits,"This course will explore the United States Constitution and the legal doctrines that have emerged from it, using them as lenses through which to understand the history—and shape the future—of this country. Using prominent Supreme Court opinions as teaching tools and loci of debate (including cases on the Court’s recent and current docket), this course will explore the different kind of theoretical approaches with which to make Constitutional arguments and interpret the Constitution. It is one of two paired courses (the other being POSC 271) that complement each other. Both courses will address the structure and functioning of the United States government, and will explore in greater depth the historic Constitutional “trends” towards greater equality and more liberty (albeit slowly, haltingly, and with steps both forward and backward). This course will focus in particular on how gender equality is very much unfinished Constitutional work on our way towards a “more perfect union.” This topic will include an examination of the Court’s recent controversial decision in Dobbs v. Jackson Women’s Health Organization. In exploring matters of personal liberty, this course will focus in particular on First Amendment freedom of speech and other fundamental rights protected under the Fourteenth Amendment’s Due Process Clause. Finally, in examining governmental structures, this course will emphasize the separation of powers across the branches of the federal government. The course will require close reading of judicial opinions and other texts, and learning how to construct arguments using logic and precedent. POSC 271 is not a prerequisite for POSC 272. The two courses can be taken independently, although having taking POSC 271 will provide students with a broader and more nuanced foundation for exploring the themes covered of this course",Spring 2025,"SI, Social Inquiry","AMST Democracy Activism, AMST Race Ethnicty Indign, AMST Survey 2, POSI Elective, PPOL Other Comparative, CL: 200 level",,Steven Poskanzer,"M, W",Hasenstab 105,11:10am-12:20pm,
POSC 302,Subordinated Politics and Intergroup Relations,6 credits,"How do social and political groups interact? How do we understand these interactions in relation to power? This course will introduce the basic approaches and debates in the study of prejudice, racial attitudes, and intergroup relations. We will focus on three main questions. First, how do we understand and study prejudice and racism as they relate to U.S. politics? Second, how do group identities, stereotyping, and other factors help us understand the legitimation of discrimination, group hierarchy, and social domination? Third, what are the political and social challenges associated with reducing prejudice?",Spring 2025,"IDS, Intercultural Domestic Studies, SI, Social Inquiry","AFST Social Inquiry, AMST Democracy Activism, AMST Race Ethnicty Indign, AMST Space and Place, EDUC 2 Soc and Cult Context, POSI Elective, CL: 300 level",,Christina Farhart,"T, TH",Hasenstab 109,1:15pm-3:00pm,
POSC 315,Polarization and Democratic Decline in the United States,6 credits,"The United States is more politically polarized today than at any time since the late nineteenth century, leaving lawmakers, journalists, and experts increasingly concerned that the toxicity in our politics is making the country vulnerable to political instability, violence, and democratic decline. Moreover, citizens are increasingly willing to call into question the legitimacy of this country’s core electoral and governing institutions. How did the U.S. get to this point? What can be done about it? This course will examine political polarization as a central feature of American politics and the consequences for American democracy.",Spring 2025,"IDS, Intercultural Domestic Studies, QRE, Quantitative Reasoning, SI, Social Inquiry","ACE Applied, AMST Democracy Activism, AMST Race Ethnicty Indign, AMST Space and Place, POSI Elective, CL: 300 level",,Ryan Dawkins,"M, W",Hasenstab 109,11:10am-12:20pm,
POSC 322,Polarization and Populism in Latin America,6 credits,"Polarization and populism have shaped Latin American politics and development for much of the region's history. These forces have re-emerged in the post-Cold War period in acute and powerful ways in threatening democracy and systems of accountability. This course will examine these forces and adjacent phenomena such as democratic backsliding, the aggrandizement of presidential powers, socio-economic conflicts, contentious politics, and the continuation of state crises in Latin America. Students will work on their own research projects.",Spring 2025,"IS, International Studies, QRE, Quantitative Reasoning, SI, Social Inquiry, WR2 Writing Requirement 2","LTAM 300 HIST/SOAN/POSC, POSI Elective, LTAM Electives, CL: 300 level",,Alfred Montero,"M, W",Hasenstab 002,12:30pm-3:00pm,
POSC 333,Global Social Changes and Sustainability,6 credits,"This course is about the relationship between social changes and ecological changes to understand and to be able to advance analytical concepts, research methods, and theories of society-nature interactions. How do livelihoods of individuals and groups change over time and how do the changes affect ecological sustainability? What are the roles of human institutions in ecological sustainability? What are the roles of ecosystem dynamics in institutional sustainability? Students will learn fundamental theories and concepts that explain linkages between social change and environmental changes and gain methods and skills to measure social changes qualitatively and quantitatively.Extra Time required.",Spring 2025,"IS, International Studies, QRE, Quantitative Reasoning, SI, Social Inquiry, WR2 Writing Requirement 2","ENTS Society, Culture and Policy, ENTS Topical Seminar, POSI Elective, PPOL Envir Pol & Sustainablty, CL: 300 level",,Tun Myint,"T, TH",CMC 328,10:10am-11:55am,
POSC 348,"Strangers, Foreigners and Exiles",6 credits,"The course explores the role that strangers play in human life, the challenges that foreigners create for democratic politics, the promises they bring to it, as well as the role of exiles in improving the cultural capacity of societies to live with difference. We will read texts by Arendt, Kafka, Derrida, Sophocles, Said, Joseph Conrad, Tzvetan Todorov, and Julia Kristeva. Special attention will be given to the plight of Roma in Europe, as a typical case of strangers that are still perceived nowadays as a menace to the modern sedentary civilization.",Spring 2025,"IS, International Studies, SI, Social Inquiry","CCST Encounters, FFST Social Science, FREN Pertinent, POSI Elective, CL: 300 level",,Mihaela Czobor-Lupp,"T, TH",Weitz Center 231,10:10am-11:55am,
PSYC 110,Principles of Psychology,6 credits,"This course surveys major topics in psychology. We consider the approaches different psychologists take to describe and explain behavior. We will consider a broad range of topics, including how animals learn and remember contexts and behaviors, how personality develops and influences functioning, how the nervous system is structured and how it supports mental events, how knowledge of the nervous system may inform an understanding of conditions such as schizophrenia, how people acquire, remember and process information, how psychopathology is diagnosed, explained, and treated, how infants and children develop, and how people behave in groups and think about their social environment.",Spring 2025,"SI, Social Inquiry","PSYC Introductory, CL: 100 level",,Julie Neiworth,"M, W",Anderson Hall 121,12:30pm-1:40pm,
PSYC 200,Measurement and Data Analysis in Psychology,6 credits,"The course considers the role of measurement and data analysis focused on behavioral sciences. Various forms of measurement and standards for the evaluation of measures are explored. Students learn how to summarize, organize, and evaluate data using a variety of techniques that are applicable to research in psychology and other disciplines. Among the analyses discussed and applied are tests of means, various forms of analysis of variance, correlation and regression, planned and post-hoc comparisons, as well as various non-parametric tests. Research design is also explored.",Spring 2025,"FSR, Formal or Statistical Reasoning, QRE, Quantitative Reasoning","CGSC Core, PSYC Methods, SDSC XDept Elective, CL: 200 level",Student has completed any of the following course(s):PSYC 110– Principles of Psychology with a grade of C- OR CGSC/PSYC 232– Cognitive Processes and CGSC/PSYC 233– Laboratory Cognitive Processes with a grade of C- or better or received a score of 4 or better on the Psychology AP exam or received a score of 6 or better on the Psychology IB exam.,Mitchell Campbell,"T, TH",Anderson Hall 121,10:10am-11:55am,
PSYC 201,Measurement and Data Analysis Lab,2 credits,"This lab course accompanies the lecture course, Psychology 200, and must be taken during the same term. The lab will provide an opportunity to explore lecture topics more deeply, and in particular emphasize data collection and computational skills.PSYC 200 required.",Spring 2025,"QRE, Quantitative Reasoning","CGSC Core, PSYC Methods",,Mitchell Campbell,"T, TH",Olin 104,1:15pm-3:00pm,
PSYC 216,Behavioral Neuroscience,6 credits,"An introduction to the physiological bases of complex behaviors in mammals, with an emphasis on neural and hormonal mechanisms. Psychology 216 does not require concurrent registration in Psychology 217, however, a grade of C- or better must be earned in both Psychology 216 and 217 to satisfy the LS requirement. Expected preparation: Psychology 110 or instructor permission.",Spring 2025,"LS, Science with Lab","CGSC Elective, NEUR Elective, PSYC Biolgcl & Behavrl Proc, PSYC Core, CL: 200 level",,Lawrence Wichlinski,"M, W",Boliou 104,11:10am-12:20pm,
PSYC 217,Laboratory Research Methods in Behavioral Neuroscience,2 credits,"The course provides instruction and experience in methods of behavioral neuroscience, the study of the inter-relation of the brain (and hormonal systems) and behavior. The focus of this laboratory will be on standard methods of inducing behavioral changes via neural and hormonal manipulations in mammals. Psychology 217 does NOT require concurrent registration in Psychology 216. A grade of C- or better must be earned in both Psychology 216 and 217 to satisfy the LS requirement. Expected preparation: Psychology 110 or instructor permission.",Spring 2025,"LS, Science with Lab","NEUR Elective, PSYC Laboratory",,Lawrence Wichlinski,"M, W",Hulings B12,2:00pm-4:00pm,
PSYC 220,Sensation and Perception,6 credits,"We will address the question of how humans acquire information from the world to support action, learning, belief, choice, and the host of additional mental states that comprise the subject matter of psychology. In other words “How do we get the outside inside?” We will initially consider peripheral anatomical structures (e.g., the eye) and proceed through intermediate levels of sensory coding and transmission to cover the brain regions associated with each of the major senses. Readings will include primary sources and a text. In addition to exams and papers, students will conduct an investigation into an area of personal interest. A grade of C- or better must be earned in both Psychology 220 and 221 to satisfy the LS requirement.",Spring 2025,"LS, Science with Lab","CGSC Elective, NEUR Elective, PSYC Biolgcl & Behavrl Proc, PSYC Cognitive Studies, PSYC Core, CL: 200 level",Student has completed any of the following course(s):PSYC 110– Principles of Psychology with a grade of C- or better or received a score of 4 or better on the Psychology AP exam or received a score of 6 or better on the Psychology IB exam.,Julia Strand,"M, W",Olin 141,9:50am-11:00am,
PSYC 256,Social Behavior and Interpersonal Processes,6 credits,"The social psychological analysis of human social behavior, interpersonal processes, and group influences. Concurrent registration in PSYC 257 is optional, but strongly encouraged. A grade of C- or better must be earned in both Psychology 256 and 257 to satisfy the LS requirement.Concurrent registration in Psychology 257 is optional, but strongly recommended.",Spring 2025,"LS, Science with Lab","PSYC Core, PSYC Soc,Dev,Pers,Clin & Health, CL: 200 level",Student has completed any of the following course(s):PSYC 110– Principles of Psychology with a grade of C- or better or received a score of 4 or better on the Psychology AP exam or received a score of 6 or better on the Psychology IB exam.,Sharon Akimoto,"T, TH",Weitz Center 235,10:10am-11:55am,
PSYC 257,Laboratory Research Methods in Social Behavior and Interpersonal Processes,2 credits,Students will participate in the planning and replication of empirical studies of the social psychology of social behavior. Requires concurrent registration in Psychology 256. A grade of C- or better must be earned in both Psychology 256 and 257 to satisfy the LS requirement.PSYC 256 required.,Spring 2025,"LS, Science with Lab, QRE, Quantitative Reasoning",PSYC Laboratory,,Sharon Akimoto,W,Olin 06,2:00pm-5:00pm,
PSYC 354,Counseling Psychology,6 credits,"This course provides an introduction to the field of counseling psychology, exploring its fundamental principles and practices. Students will gain a comprehensive understanding of various counseling theories and treatment modalities, including their historical development and practical application. Students will also explore research methodologies utilized in counseling psychology and critically analyze empirical studies to inform evidence-based practice. Additionally, the course addresses professional issues, ethical considerations, and multicultural factors that influence counseling psychology, fostering cultural competence and awareness of diverse populations.",Spring 2025,"SI, Social Inquiry","PSYC Upper Level, CL: 300 level",Student has completed any of the following course(s):PSYC 110– Principles of Psychology with a grade of C- or better or received a score of 4 or better on the Psychology AP exam or received a score of 6 or better on the Psychology IB exam.,Emily Hazlett,"T, TH",Olin 102,1:15pm-3:00pm,
PSYC 382,Topics in Social and Personality: Endings,6 credits,"This seminar will examine the psychology of endings, including endings associated with psychotherapy, social interactions, personal relationships, social roles, literature and the arts, and life itself. We will address when and how endings occur, how we experience endings, and what makes an ending a good or poor one, among other issues.",Spring 2025,"SI, Social Inquiry","PSYC Seminar, PSYC Upper Level, CL: 300 level",Student has completed any of the following course(s):PSYC 252– Personality orPSYC 256– Social Behavior and Interpersonal Processes orPSYC 258– Social Cognition with grade of C- or better.,Neil Lutsky,"T, TH",Olin 104,10:10am-11:55am,
PSYC 389,LGBTQ+ Psychology,6 credits,"In this seminar, we will examine the psychology of LGBTQ+ people, focusing on topics such as LGBTQ+ identity development; predictors and consequences of anti-LGBTQ+ bias and discrimination; the health and well-being of LGBTQ+ people; and familial and relationship dynamics of LGBTQ+ populations. We will consider psychology's history of—and potential for—both contributing to and dismantling the inequities faced by LGBTQ+ populations.",Spring 2025,"IDS, Intercultural Domestic Studies, SI, Social Inquiry","GWSS Elective, PSYC Seminar, PSYC Upper Level, CL: 300 level","Student has completed any of the following course(s): Psychology 110 – Principles of Psychology orGWSS 110– Introduction to Gender, Women's & Sexuality orGWSS 200– Gender, Sexuality and the Pursuit of Knowledge orGWSS 212– Foundations of LGBTQ Studies with a grade of C- or better or received a score of 4 or better on the Psychology AP exam or received a score of 6 or better on the Psychology IB exam.",Emma McGorray,"T, TH",Olin 106,1:15pm-3:00pm,
RELG 110,Understanding Religion,6 credits,"How can we best understand the role of religion in the world today, and how should we interpret the meaning of religious traditions–their texts and practices–in history and culture? This class takes an exciting tour through selected themes and puzzles related to the fascinating and diverse expressions of religion throughout the world. From politics and pop culture, to religious philosophies and spiritual practices, to rituals, scriptures, gender, religious authority, and more, students will explore how these issues emerge in a variety of religions, places, and historical moments in the U.S. and across the globe.",Spring 2025,"HI, Humanistic Inquiry, IDS, Intercultural Domestic Studies, WR2 Writing Requirement 2","CCST Encounters, CCST Seeing and Being Cross-Cult, RELG Pertinent Course, CL: 100 level",,Chumie Juni,"M, W",Leighton 304,12:30pm-1:40pm,
RELG 121,Introduction to Christianity,6 credits,"This course will trace the history of Christianity from its origins in the villages of Palestine, to its emergence as the official religion of the Roman Empire, and through its evolution and expansion as the world’s largest religion. The course will focus on events, persons, and ideas that have had the greatest impact on the history of Christianity, and examine how this tradition has evolved in different ways in response to different needs, cultures, and tensions–political and otherwise–around the world. This is an introductory course. No familiarity with the Bible, Christianity, or the academic study of religion is presupposed.",Spring 2025,"HI, Humanistic Inquiry, IDS, Intercultural Domestic Studies, QRE, Quantitative Reasoning, WR2 Writing Requirement 2","MARS Supporting, RELG Breadth, RELG Christian Traditions, RELG Pertinent Course, SDSC XDept Elective, CL: 100 level",,Lori Pearson,"M, W",Leighton 236,9:50am-11:00am,
RELG 155,Hinduism: An Introduction,6 credits,"Hinduism is the world’s third-largest religion (or, as some prefer, “way of life”), with about 1.2 billion followers. It is also one of its oldest, with roots dating back at least 3500 years. “Hinduism,” however, is a loosely defined, even contested term, designating the wide variety of beliefs and practices of the majority of the people of South Asia. This survey course introduces students to this great variety, including social structures (such as the caste system), rituals and scriptures, mythologies and epics, philosophies, life practices, politics, poetry, sex, gender, Bollywood, and—lest we forget—some 330 million gods and goddesses.",Spring 2025,"HI, Humanistic Inquiry, IS, International Studies, QRE, Quantitative Reasoning, WR2 Writing Requirement 2","ASST Pertinent, ASST South Asia, CCST Encounters, MARS Supporting, RELG Breadth, RELG Hindu Traditions, RELG Pertinent Course, SAST Humanistic Inquiry, SAST Supp Humanities, SDSC XDept Elective, CL: 100 level",,Kristin Bloomer,"T, TH",CMC 210,1:15pm-3:00pm,
RELG 213,"Religion, Medicine, and Healing",6 credits,"How do religion and medicine approach the healing of disease and distress? Are religion and medicine complementary or do they conflict? Is medicine a more evolved form of religion, shorn of superstition and pseudoscience? This course explores religious and cultural models of health and techniques for achieving it, from ancient Greece to Christian monasteries to modern mindfulness and self-care programs. We will consider ethical quandaries about death, bodily suffering, mental illness, miraculous cures, and individual agency, all the while seeking to avoid simplistic narratives of rationality and irrationality.",Spring 2025,"HI, Humanistic Inquiry, IDS, Intercultural Domestic Studies, WR2 Writing Requirement 2","CCST Encounters, PPOL Ethics, RELG Christian Traditions, RELG Pertinent Course, CL: 200 level",,Sonja Anderson,"M, W",Laird 206,11:10am-12:20pm,
RELG 221,Judaism and Gender,6 credits,"How does gender shape the Jewish tradition, and how have Jewish historical moments, texts, and practices shaped Jewish notions of gender? Taking Judaism as a test case, this course will explore the relationship between historical circumstance, positionality, and the religious imaginary. We will examine the ways that Jewish gender and theology inform each other. We will see how gender was at play in Jewish negotiations of economic and social class, racial and ethnic status, even citizenship. Following the threads of practice and narrative, we will think about how intersectional gender has shaped the stories Jews tell, and the stories that are told about them.",Spring 2025,"HI, Humanistic Inquiry, IDS, Intercultural Domestic Studies, WR2 Writing Requirement 2","GWSS Elective, JDST Pertinent, MEST Supporting Group 1, RELG Jewish Traditions, RELG Pertinent Course, CL: 200 level",,Chumie Juni,"M, W",Leighton 426,9:50am-11:00am,
RELG 261,Race & Empire in American Islam,6 credits,"From colonial times when Muslims were brought to America as slaves, to the aftermath of the Spanish-American War when the United States found itself ruling over a large Muslim population in the Philippines, to the more recent War on Terror, Muslims and Islam have long been entangled in the politics of race and empire in America. This course will examine these entanglements through primary and secondary sources to better understand the role that race, religion, and empire have played in the forging of American Islam today.",Spring 2025,"HI, Humanistic Inquiry, IDS, Intercultural Domestic Studies, WR2 Writing Requirement 2","RELG Islamic Traditions, RELG Pertinent Course, AMST America in the World, AMST Race Ethnicty Indign, CL: 200 level",,Kambiz GhaneaBassiri,"T, TH",Library 344,3:10pm-4:55pm,
RELG 265,"Religion and Violence: Hindus, Muslims, Jews",6 credits,"Why do religious people do violence—in their words and deeds, against themselves and others? Is violence a distortion of real religion? Is it the inevitable result of certain beliefs? Or are these the wrong questions? This course considers several case studies of religious violence drawn from different traditions and time periods, including ancient paganism, early Christianity, Judaism, Islam, and so-called cults. Our approach will be historical, literary, and comparative. We will seek to understand how violence can be meaningful as a religious act, and how adherents of the same religious tradition can have widely diverse views on violence and nonviolence.",Spring 2025,"HI, Humanistic Inquiry, WR2 Writing Requirement 2, IDS, Intercultural Domestic Studies","GWSS Elective, MEST Supporting Group 1, CL: 200 level, JDST Pertinent, MARS Supporting, RELG Christian Traditions",,Sonja Anderson,"M, W",Leighton 330,1:50pm-3:00pm,
RELG 344,Lived Religion in America,6 credits,"The practices of popular, or local, or lived religion in American culture often blur the distinction between the sacred and profane and elude religious studies frameworks based on the narrative, theological, or institutional foundations of “official” religion. This course explores American religion primarily through the lens of the practices of lived religion with respect to ritual, the body, the life cycle, the market, leisure, and popular culture. Consideration of a wide range of topics, including ritual healing, Christmas, cremation, and Elvis, will nourish an ongoing discussion about how to make sense of lived religion.",Spring 2025,"HI, Humanistic Inquiry, IDS, Intercultural Domestic Studies, WR2 Writing Requirement 2","AMST Prdctn Consmptn Cult, RELG Christian Traditions, RELG Pertinent Course, RELG Traditions Americas, CL: 300 level",,Michael McNally,"T, TH",Leighton 303,10:10am-11:55am,
RUSS 103,Elementary Russian,6 credits,Concludes introductory method of Russian 101-102.,Spring 2025,No Exploration,CL: 100 level,Student has completed any of the following course(s):RUSS 102– Elementary Russian with a grade of C- or better or equivalent.,Laura Goering,"M, W",Language & Dining Center 242,9:50am-11:00am,
RUSS 110,Russophone Studies: Intensive Beginning,6 credits,"For students with no previous training in or minimal knowledge of Russian. Simultaneous development of skills in speaking, reading, aural comprehension, and writing. Class meets four days a week for two hours. This course is conducted by members of Kazakh National University’s Philological Faculty and supervised by the program director.",Spring 2025,LP Language Requirement,"RUSS Elective, CL: 100 level",Acceptance in the Carleton OCS Russophone Studies in Central Asia program.,Victoria Thorstensson,,,,
RUSS 207,Russophone Studies in Central Asia: Intermediate Intensive Grammar,3 credits,This course aims at vocabulary expansion and the assimilation and activation of everyday conversational structures and speech etiquette at the same time it develops familiarity with more complex principles of Russian grammar. This course is conducted by members of Kazakh National University's Philological Faculty and supervised by the program director.Open only to participants in Carleton OCS Program: Russophone Studies in Central Asia,Spring 2025,No Exploration,"RUSS Elective, CL: 200 level",Acceptance in the Russophone Studies in Central Asia program and student has completed any of the following course(s):RUSS 205– Russian in Cultural Context with a grade of C- or better.,Victoria Thorstensson,,,,
