Course Number,Course Title,Credits,Description,Offered Term,Liberal Arts Requirements,Tags,Prerequisites,Faculty,Meeting Day,Location,Time,Unnamed: 12
AFST 289,Global Blackness and Social Movements,6 credits,"This course considers Black social movements from around the globe, with an emphasis on non-U.S. contexts.  Examining multiple movements both past and present, it takes a comparative approach to understanding the unique and variable ways that Black communities have articulated the Black condition, and mobilized and resisted oppression.  Central to the course is the question of Blackness as a global and transnational identity; as well as the extent to which movements themselves form ties and mutually inform each other across national boundaries.",Spring 2025,"IS, International Studies, SI, Social Inquiry, WR2 Writing Requirement 2","AFST Social Inquiry, SOAN Pertinent, AFST Core, CL: 200 level",,Daniel Williams,"T, TH",Leighton 402,10:10am-11:55am,
AFST 300,"Race, Racism, and the Beloved Community in the US",6 credits,"Race and racism played a significant role in the construction of the United States of America. But so did the quest for a more perfect union and the beloved community. This course introduces students to the complexity of racial ideology and the ways it privileges one group of people while placing others at a disadvantage. We shall examine the experiences of all racialized groups (Blacks, Asians, American Indians, Latinos) and how they resisted the injustice against them. Most importantly, we shall analyze how their quest for liberation brought America closer to its foundational ideal that all humans are created equal and are endowed with unalienable rights.",Spring 2025,"HI, Humanistic Inquiry, IDS, Intercultural Domestic Studies, WR2 Writing Requirement 2","AFST Humanistic Inquiry, AFST Core, CL: 300 level",Student has completed any of the following course(s): One course that applies toward the Humanistic Inquiry requirement with a grade of C- or better.,Chielo Eze,"T, TH",Leighton 330,1:15pm-3:00pm,
AMST 115,Introduction to American Studies,6 credits,"This overview of the “interdisciplinary discipline” of American Studies will focus on the ways American Studies engages with and departs from other scholarly fields of inquiry. We will study the stories of those who have been marginalized in the social, political, cultural, and economic life of the United States due to their class, race, ethnicity, gender, sexual orientation, religion, citizenship, and level of ability. We will explore contemporary American Studies concerns like racial and class formation, the production of space and place, the consumption and circulation of culture, and transnational histories.Sophomore Priority",Spring 2025,"HI, Humanistic Inquiry, IDS, Intercultural Domestic Studies, WR2 Writing Requirement 2","AMMU Music Foundations, CCST Seeing and Being Cross-Cult, EDUC 2 Soc and Cult Context, HIST Pertinent Courses, HIST US History, CL: 100 level",,Christopher Elias,"M, W",Willis 204,11:10am-12:20pm,
AMST 269,Woodstock Nation,6 credits,"“If you remember the Sixties, you weren’t there.”  We will test the truth of that popular adage by exploring the American youth counterculture of the 1960s, particularly the turbulent period of the late sixties. Using examples from literature, music, and film, we will examine the hope and idealism, the violence, confusion, wacky creativity, and social mores of this seminal decade in American culture. Topics explored will include the Beat Generation, the Vietnam War, Civil Rights, LSD, and the rise of environmentalism, feminism, and Black Power.Extra time",Spring 2025,"IDS, Intercultural Domestic Studies, LA, Literary/Artistic Analysis, WR2 Writing Requirement 2","AMMU Soundtracks America, AMST Democracy Activism, AMST Prdctn Consmptn Cult, AMST Race Ethnicty Indign, CAMS Extra Departmental, ENGL Historical Era 3, ENGL Tradition 2, CL: 200 level",,Michael Kowalewski,"M, W",Laird 206,12:30pm-1:40pm,
AMST 321,Indigenous Chicago: Indigenous Histories and Futures in Zhegagoynak,6 credits,"Before Chicago as we know it today existed, many Indigenous nations had long standing relationships with this place. They knew it as Zhegagoynak, Gaa-zhigaagwanzhikaag, Zhigaagong, Šikaakonki, Shekâkôheki, Sekakoh, and Guušge honak, among others. This course emerges from four years of community-engaged curriculum development and examines Chicago histories through five themes: Chicago's lands and environment, Chicago as a Native place, Chicago as a place of convergence, activism and resistance in Chicago, and community-driven education movements in Chicago. Drawing from History, American Studies, Education, and Indigenous Studies, students will also examine how research and curricula can center Indigenous perspectives and sources.",Spring 2025,"HI, Humanistic Inquiry, IDS, Intercultural Domestic Studies","AMST Race Ethnicty Indign, AMST Space and Place, CL: 300 level, HIST US History",,Meredith McCoy,,,,
AMST 396.00,Producing Latinidad,6 credits,"As Arlene Dávila points out inLatinos Inc, Latinidad—the term that names a set of presumably common attributes that connects Latinxs in the U.S.—emerges in part from communities but, importantly, is developed heavily by the media, advertising, and other political and social institutions, including academia. In this course we consider how ideas and imaginings of who Latinxs are and what Latinidad is develop within political spaces (the electorate, the census), in local places, and through various media, including television, advertising, and music. We will consider how individual writers and artists contribute to the conversation. Throughout, we will engage with social and cultural theories about racial formation, gender, and sexuality.",Spring 2025,"HI, Humanistic Inquiry, IDS, Intercultural Domestic Studies, WR2 Writing Requirement 2","CL: 300 level, GWSS Elective, LTAM Electives",Student has completed any of the following course(s):AMST 115– Introduction to American Studies with grade of C- or better.,Adriana Estill,"T, TH",Laird 218,10:10am-11:55am,
ARBC 103,Elementary Arabic,6 credits,"This course sequence introduces non-Arabic speakers to the sounds, script, and basic grammar of Arabic–the language of 200 million speakers in the Arab world and the liturgical language of over a billion Muslims. Students will develop basic listening, speaking, reading and writing skills in Modern Standard Arabic. Classes will incorporate readings and audio-visual material from contemporary Arabic media, as well as popular music.",Spring 2025,No Exploration,"MEST Pertinent, MEST Pertinent, CL: 100 level",Student has completed any of the following course(s):ARBC 102– Elementary Arabic with a grade C- or better or equivalent.,Zaki Haidar,"M, W",Language & Dining Center 244,9:50am-11:00am,
ARBC 206,Arabic in Cultural Context,6 credits,"In this course students will continue to develop their Arabic language skills, including expanding their command of Arabic grammar, improving their listening comprehension, reading and writing skills. In addition to more language-focused training, the course will introduce students to moreáadvanced readings, including literary texts (prose and poetry, classical and modern) and op-ed articles from current media. Class discussions will be in Arabic.",Spring 2025,No Exploration,"MEST Supporting Group 2, CL: 200 level",Student has completed any of the following course(s):ARBC 205– Intermediate Arabic with a grade of C- or better or equivalent.,Zaki Haidar,"M, W",Weitz Center 136,1:50pm-3:00pm,
ARBC 222,Music in the Middle East,6 credits,"The Middle East is home to a great number of musical styles, genres, and traditions. Regional, ideological, and cultural diversity, national identity, and cross-cultural encounters–all express themselves in music. We will explore some of the many musical traditions in the Arab world, from early twentieth century to the present. Class discussions based on readings in English and guided listening. No prior music knowledge required, but interested students with or without musical background can participate in an optional, hands-on Arab music performance workshop, on Western or a few (provided) Middle Eastern instruments throughout the term.",Spring 2025,"CX, Cultural/Linguistics, IS, International Studies, LA, Literary/Artistic Analysis","MEST Supporting Group 2, MUSC Ethnomusicolgy or Pop, CL: 200 level",,Yaron Klein,"M, W",Weitz Center 230,12:30pm-1:40pm,
ARBC 223,Arab Music Workshop,1 credits,"Through music making, this workshop introduces students to Arab music and some of its distinctive features, such as microtonality, modality (maqam), improvisation (taqsim) and rhythmic patterns (iqa’at). Students may elect to participate playing on an instrument they already play, or elect to study the oud (the Arab lute). Ouds and percussion instruments will be provided.ARBC 222 required.",Spring 2025,"ARP, Arts Practice","MEST Pertinent, MEST Pertinent, MEST Supporting Group 2",,Yaron Klein,,,,
ARBC 371,Readings in Premodern Arabic Science,3 credits,"It is difficult to overstate Arab scientists’ contribution to science. A translation movement from Greek, Persian and Sanskrit into Arabic initiated in the eighth century, led to centuries of innovative scientific investigation, during which Arab scientists reshaped science in a variety of disciplines: from mathematics to astronomy, physics, optics and medicine. Many of their works entered Latin and the European curriculum during the Renaissance. In this reading course we will explore some of the achievements and thought processes in premodern Arabic scientific literature by reading selections from several seminal works. We will examine these in the cultural contexts in which they emerged and to which they contributed, and reflect on modern Western perceptions of this intellectual project. Readings and class discussions will be in both Arabic and English.",Spring 2025,"IS, International Studies, LA, Literary/Artistic Analysis","MEST Pertinent, MEST Pertinent, CL: 300 level",Student has completed any of the following course(s):ARBC 206– Arabic in Cultural Context or equivalent with a grade of C- or better.,Yaron Klein,"M, W",Weitz Center 231,1:50pm-3:00pm,
ARCN 112,Archaeology of Native North America,6 credits,"When did humans first migrate to North America? How long have people lived in Minnesota? This course will examine the material culture of Indigenous peoples throughout the North American continent above Mexico, from c. 20,000 years ago to present. Cultural groups include the Inuit, Iroquois, ancient Puebloans, Cahokia, Great Plains villages, and Pacific Northwest (Kumash) peoples. We will study Indigenous oral histories, genetic data, linguistics, material remains, and ethnohistorical accounts to examine migration, trade, and contact, with an emphasis on decolonization and Indigenous archaeologies.",Spring 2025,"IDS, Intercultural Domestic Studies, SI, Social Inquiry","AMST Race Ethnicty Indign, AMST Space and Place, MARS Supporting, SOAN Pertinent, CL: 100 level, ARCN Pertinent",,Sarah Kennedy,"M, W",Language & Dining Center 302,9:50am-11:00am,
ARCN 222,Experimental Archaeology and Experiential History and Lab,6 credits,"This course offers an experiential approach to crafts, technologies, and other material practices in premodern societies. Through hands-on activities and collaborations with local craftspeople, farmers, and other experts, this course will examine and test a variety of hypotheses about how people in the past lived their lives. How did prehistoric people produce stone tools, pottery, and metal? How did ancient Greeks and Romans feed and clothe themselves? How did medieval Europeans build their homes and bury their dead? Students will answer these questions and more by actively participating in a range of experimental archaeology and experiential history projects. Lab required.",Spring 2025,"LS, Science with Lab","ARCN Pertinent, CLAS Civ Archaeologcl Anlys, DGAH Cross Disc Collabortn, MARS Supporting, CL: 200 level",Student has completed any of the following course(s): One Archaeology Pertinent (tagged ARCN Pertinent) course with a grade of C- or better.,Austin Mason,"M, W",Anderson Hall 122,11:10am-12:20pm,
ARTH 214,Queer Art,6 credits,"Beyond surveying the rich history of arts by LGBTQA+ individuals, this course takes as its object of study the ways in which the arts have been used to question, undermine, and subvert the gendered and sexual norms of dominant cultures—in short, to queer them. In so doing, such visual and performative practices offer new, alternative models of living and acting in the world based on liberatory politics and aesthetics. This course will consider topics such as: censorship of queer artists; art of the AIDS crisis; activist performance; the sexual politics of public space; and queer intersections of race, class and gender in visual art among others.Extra time",Spring 2025,"IDS, Intercultural Domestic Studies, LA, Literary/Artistic Analysis","ARTS ARTH Post 1900, GWSS Elective, CL: 200 level",Student has completed any of the following course(s): One Art History (ARTH) course with a grade of C- better.,Ross Elfline,"M, W",Boliou 161,11:10am-12:20pm,
ARTH 298,The History of Art History,6 credits,An intensive study of the nature of art history as an intellectual discipline and of the approaches scholars have taken to various art historical problems. Attention as well to principles of current art historical research and writing. Recommended for juniors who have declared art history as a major or a minor.,Spring 2025,"LA, Literary/Artistic Analysis","ASST Disciplinary, ASST Methodology, CL: 200 level",,Jessica Keating,"T, TH",Boliou 161,10:10am-11:55am,
ARTS 113,Field Drawing,6 credits,"A beginning drawing course for students who are interested in developing their skills in drawing from nature, to better see and understand their surroundings. Class material covers line, form, dimension, value, perspective, and space using a variety of drawing materials. Subject matter includes specimens, plant forms, and the landscape. Students will use a portable sketchbook, and classes during the second part of the term are primarily outside. Locations include the Arb and field trips; access to these sites does include walking on unpaved paths and uneven terrain.Sophomore Priority;Two seats held for Art and Art History majors until the day after junior priority registration.",Spring 2025,"ARP, Arts Practice","ARTS 2-D Emphasis, ENTS Society, Culture and Policy, CL: 100 level",,Eleanor Jensen,"T, TH",Weitz Center 242,9:00am-11:30am,
ARTS 122,Introduction to Sculpture,6 credits,"The ability to build structures that reflect or alter the environment is a basic defining characteristic of our species. In this class we explore creative construction in three dimensions using a variety of media, including plaster, wood, and steel. Using both natural and architectural objects for inspiration, we will examine and manipulate form, space, and expressive content to develop a deeper understanding of this core trait and reawaken our experience of the spaces we inhabit.Sophomore Priority; Three seats held for Art and Art History majors until the first day of sophomore registration.Extra Time Required for field trip",Spring 2025,"ARP, Arts Practice","ARTS 3-D Emphasis, CL: 100 level",,Stephen Mohring,"T, TH",Boliou 020,1:15pm-3:45pm,
ARTS 139,Beginning Photography,6 credits,"In this course students explore photography as a means of understanding and interacting with both the world and the inner self. We will emphasize a balance of technical skills, exploration of personal vision, and development of critical thinking and vocabulary relating to photography. Beginning students will learn how to use analogue and digital cameras, to use basic studio lighting equipment, and to print their own photographic work. Additionally, students will learn to develop a portfolio as an ongoing process that requires informed and critical decision making to assemble a body of work. Collectively we will critique, analyze, give feedback on work, and discuss readings that are pertinent to the production of images in contemporary times.Sophomore Priority; Two seats held for Art and Art History majors until the day after junior priority registration.",Spring 2025,"ARP, Arts Practice",CL: 100 level,,Xavier Tavera Castro,"M, W",Boliou 130,8:30am-11:00am,
ARTS 230,Ceramics: Throwing,6 credits,"This course is focused on the creative possibilities of the pottery wheel as a means to create utilitarian objects. Students are challenged to explore conceptual ideas while maintaining a dedication to function. An understanding of aesthetic values and technical skills are achieved through studio practice, readings, and demonstrations. Basic glaze and clay calculations, high fire and wood kiln firing techniques, and a significant civic engagement component, known as the Empty Bowls Project, are included in the course.Two seats held for Art and Art History majors until the day after junior priority registration.",Spring 2025,"ARP, Arts Practice","ACE Applied, ARTS 3-D Emphasis, CL: 200 level",Student has completed any of the following course(s):ARTS 130– Beginning Ceramics orARTS 236– Ceramics: Vessels for Tea with a grade of C- or better.,Kelly Connole,"M, W",Boliou 046,12:30pm-3:00pm,
ARTS 252,Metalsmithing: Ancient Technology- New Technologies,6 credits,"This course focuses on lost wax casting, 3D modeling and printing, and stone setting as methods to create jewelry and small sculptural objects in bronze and silver. Specific instruction will be given in the proper use of tools, torches, and other equipment, wax carving, and general metalsmithing techniques. Through the use of 3D modeling software and 3D printing, new technologies will expedite traditional processes allowing for a broad range of metalworking possibilities.Two seats held for Art and Art History majors until the day after junior priority registration.",Spring 2025,"ARP, Arts Practice","ARTS 3-D Emphasis, DGAH Cross Disc Collabortn, CL: 200 level",Student has completed any of the following course(s):ARTS 151– Metalsmithingwith a grade of C- or better.,Danny Saathoff,"T, TH",Boliou 044,9:00am-11:30am,
ARTS 262,Watercolor,6 credits,"This course provides an introduction to the medium of watercolor painting and gouache (opaque water-based paint) on paper surfaces. Students will develop an understanding of basic color interactions and a wide spectrum of paint application strategies from meticulous refined brushwork to fluid, expressive markmaking.Two seats held for Art and Art History majors until the day after junior priority registration.",Spring 2025,"ARP, Arts Practice","ARTS 2-D Emphasis, ARTS Pertinnt, CL: 200 level","Student has completed any of the following course(s):ARTS 110– Observational Drawing,ARTS 113– Field Drawing orARTS 114– Introduction to Drawing Architecture with grade of C- or better or equivalent.",David Lefkowitz,"M, W",Boliou 162,12:30pm-3:00pm,
ARTS 298,Junior Studio Art Practicum,6 credits,"Required for the studio major, and strongly recommended for the junior year, this seminar is for student artists considering lives as producers of visual culture. At the core of the course are activities that help build students’ identities as practicing artists. These include the selection and installation of artwork for the Junior Show, a presentation about their own artistic development, and studio projects in media determined by each student that serve as a bridge between media-specific studio art courses and the independent creative work they will undertake as Seniors in Comps. The course will also include reading and discussion about what it means to be an artist today, encounters with visiting artists and trips to exhibition venues in the Twin Cities.Extra Time",Spring 2025,No Exploration,CL: 200 level,,Jade Hoyer,"T, TH",Boliou 140,1:15pm-3:45pm,
ARTS 322,Sculpture 2: Form and Context,6 credits,"In this intimate and nimble seminar, we will continue our exploration of the many wonders of sculpture, further developing our previous studio-based investigations. During several short and two prolonged problem-based assignments we will work to develop our personal voice and a more nuanced material expression in our art.  We’ll be introducing interior and exterior site-specific installation, casting, advanced woodworking and welding techniques, as well as the potential for interactive robotics and digital media, to the range of possibilities. In Arts 322 you are free to explore the processes that most intrigue you–no specific material or sculptural format will be required.Two seats held for Art and Art History majors until the day after junior priority registration.Extra Time Required",Spring 2025,"ARP, Arts Practice","ARTS 3-D Emphasis, CL: 300 level","Student has completed of the following course(s):ARTS 122– Introduction to Sculpture,ARTS 222– Sculptural Practice,ARTS 327– Woodworking orCS 232– Art, Interactivity, and Microcontrollers with a grade of C- or better.",Stephen Mohring,"T, TH",Boliou 020,9:00am-11:30am,
ARTS 339,Advanced Photography,6 credits,"In this course students explore photography as a means of understanding and interacting with both the world and the inner self. We will emphasize a balance of technical skills, exploration of personal vision, and development of critical thinking and vocabulary relating to photography. Advanced students will focus on developing a concise body of work independently through two self-directed longer projects. Instruction includes: use of large format cameras with a hand meter, film scanning, and strobe lighting. Students will learn to develop a portfolio as an ongoing process that requires informed and critical decision making to assemble a body of work. Collectively we will critique, analyze, give feedback on work and discuss readings that are pertinent to the production of images in contemporary times.Two seats held for Art and Art History majors until the day after junior priority registration.",Spring 2025,"ARP, Arts Practice","ARTS 2-D Emphasis, CAMS Extra Departmental, DGAH Critand Ethical Reflectn, CL: 300 level",Student has completed any of the following course(s):ARTS 139– Beginning Photography orARTS 142– The Book As Art Object orARTS 244– Alternative Processes orARTS 245– Constructed Image with gradeof C- or better.,Xavier Tavera Castro,"M, W",Boliou 130,12:30pm-3:00pm,
ARTS 374,Advanced Printmaking,6 credits,"This course builds upon student’s prior introductory coursework in any printmaking media (Silkscreen, Relief, Intaglio, Risography, or Lithography). We will engage in further technical study in printmaking as well as pursue conceptual engagement in theory and readings relevant to the field. This course will emphasize student-directed learning and the integration of concept and media.",Spring 2025,"ARP, Arts Practice","ARTS 2-D Emphasis, CL: 300 level","Student has completed any of the following course(s):ARTS 273– Printmaking,ARTS 274– Printmaking,ARTS 276– Design + Art Publications orARTS 278Intaglio Printmaking with gradeof C- or better",Jade Hoyer,"T, TH",Boliou 032,9:00am-11:30am,
ASLN 111,Writing Systems,6 credits,"The structure and function of writing systems, with emphasis on a comparison of East Asian writing systems (Chinese, Japanese, Korean) to Western alphabetic systems. Topics covered include classification of writing systems, historical development, diffusion and borrowing of writing systems, and comparison with non-writing symbol systems.",Spring 2025,"CX, Cultural/Linguistics, SI, Social Inquiry","ASST East Asia, ASST Social Science, CCST Encounters, EAST Supporting, CL: 100 level, LING Elective",,Lin Deng,"M, W",Library 305,1:50pm-3:00pm,
ASST 110,Elementary Hindi Language,6 credits,"This course will introduce students to basic spoken and written Hindi and Urdu, languages spoken widely across India and Pakistan. The course will teach speaking, listening, reading and writing skills as these are used in everyday social and cultural situations. While in elementary spoken form Hindi and Urdu are almost indistinguishable, they are written in two distinct scripts, both of which students will learn.Students who have studied Hindi language on the Off-Campus Program “India: Globalization and Local Responses” are not eligible to enroll in this course.",Spring 2025,No Exploration,CL: 100 level,Not open to students that have studied the Hindi Language through the Carleton OCS India: Globalization and Local Response program.,Brendan LaRocque,"M, W",Library 305,11:10am-12:20pm,
ASST 285,"Mapping Japan, the Real and the Imagined",6 credits,"From ancient to present times, Japan drew and redrew its borders, shape, and culture, imagining its place in this world and beyond, its cultural and racial identity. This course is a cartographic exploration of this complex and contested history. Cosmological mandalas, hell images, travel brochures, and military maps bring to light the imagined Japan—its religious vision, cartographic imagination, and political ambition—that dictated its geopolitical expansion abroad and the displacement of minority peoples “at home.” We will use a variety of textual and visual materials, including those in Carleton’s Rare Book and Map Collections.",Spring 2025,"HI, Humanistic Inquiry, IS, International Studies, WR2 Writing Requirement 2","ASST East Asia, ASST Humanities, EAST Supporting, RELG Pertinent Course, RELG XDept Pertinent, DGAH Cross Disc Collabortn",,Asuka Sango,"T, TH",Leighton 236,1:15pm-3:00pm,
