Course Number,Course Title,Credits,Description,Offered Term,Liberal Arts Requirements,Tags,Prerequisites,Faculty,Meeting Day,Location,Time,Unnamed: 12
CHEM 348,Introduction to Computational Chemistry,6 credits,"This class will introduce students to computational chemistry with a focus on simulations in chemistry and biology. This course will include hands-on experience in running classical molecular dynamics and quantum chemistry programs, an introduction to methods to simulate large systems, and demonstrations of the use of more sophisticated software to simulate chemical and biological processes. It will also include a survey of the current literature in this area, as well as lecture time in which the background necessary to appreciate this growing area of chemistry will be provided.Requires concurrent registration in CHEM 349",Spring 2025,"No Exploration, QRE, Quantitative Reasoning","CHEM Elective, SDSC XDept Elective, CL: 300 level","Student has completed all of the following course(s):CHEM 343– Chemical Thermodynamics,CHEM 344– Quantum Chemistry with grade greater than or equal to C-",Daniela Kohen,"M, W",Anderson Hall 223,11:10am-12:20pm,
CHEM 349,Computational Chemistry Laboratory,2 credits,Credit for the laboratory portion of Chemistry 348.Requires concurrent registration in CHEM 348,Spring 2025,"No Exploration, QRE, Quantitative Reasoning",CHEM Elective Lab,,Daniela Kohen,TH,Anderson Hall 327,1:00pm-5:00pm,
CHEM 351,Inorganic Chemistry,6 credits,"Symmetry, molecular orbital theory and ligand field theory will provide a framework to explore the bonding, magnetism and spectroscopic properties of coordination complexes. Topics in reactivity (hard and soft acids and bases), bioinorganic chemistry, reaction mechanisms, and organometallic chemistry, will also be introduced.",Spring 2025,"No Exploration, QRE, Quantitative Reasoning","CHEM Elective, CL: 300 level",Student has completed any of the following course(s):CHEM 224– Principles Chemistry II & Lab andCHEM 234– Organic Chemistry II & Lab with grade of C- or better.,Isaac Blythe,"M, W",Anderson Hall 223,12:30pm-1:40pm,
CHEM 352,Laboratory in Advanced Inorganic Chemistry,2 credits,"Synthesis, purification and spectroscopic characterization of transition-metal complexes with an emphasis on methods for preparing and handling air-sensitive compounds. One laboratory per week.Previous or concurrent registration in CHEM 351",Spring 2025,"No Exploration, QRE, Quantitative Reasoning",CHEM Elective Lab,Student has completed or is in the process of completing the following course(s):CHEM 351– Inorganic Chemistry with grade of C- or better.,Isaac Blythe,T,Anderson Hall 325,1:00pm-5:00pm,
CHEM 362,Chemistry at the Nanoscale,6 credits,"This discussion-based seminar involves critical examination of research literature authored by prominent investigators in the interdisciplinary field of nanochemistry. Learning will draw upon the multiple disciplines of chemistry (physical, analytical, inorganic, and organic), physics, and biology. Includes a focus on the integrative themes of design, size, shape, surface, self-assembly, and defects. Novel and emerging applications in technology, biology, and medicine will be explored.",Spring 2025,No Exploration,"CHEM Elective, CL: 300 level",Student has completed or is in the process of completing any of the following course(s):CHEM 343– Chemical Thermodynamics orCHEM 344– Quantum Chemistry AND One 300 Level CHEM course with a grade of C- or better.,Trish Ferrett,"M, W",Olin 102,9:50am-11:00am,
CHIN 103,Elementary Chinese,6 credits,"Continuation of Chinese 101, 102.",Spring 2025,No Exploration,"ASST Language, CL: 100 level",Student has completed any of the following course(s):CHIN 102– Elementary Chinese with a grade of C- or better or equivalent.,Lei Yang,"M, W",Language & Dining Center 244,8:30am-9:40am,
CHIN 206,Chinese in Cultural Context,6 credits,"This course advances students’ proficiency in oral and written Chinese, at the same time integrating elements of traditional Chinese civilization and modern Chinese society. Emphasis is on cultural understanding and appropriate language use.",Spring 2025,LP Language Requirement,"ASST Arts & Literature, ASST East Asia, ASST Language, EAST Supporting, CL: 200 level",Student has completed any of the following course(s):CHIN 205– Intermediate Chinese with a grade of C- or better orsatisfied the Chinese language requirement with a Carleton placement exam score of 206.,Shaohua Guo,"M, W",Language & Dining Center 205,11:10am-12:20pm,
CHIN 251,"Heroes, Heroines, Exceptional Lives in Chinese Biographical Histories",6 credits,"Through generic and historical analysis of the two-millennia long biographical tradition in Chinese historical writing, this project explores lives of heroes and heroines, including, but not limited to: dynastic founders, ministers, generals, poets, assassins, and exceptional women. In this introduction to premodern Chinese culture and literature, students will experience, in English translation, some of the most beautiful works of ancient Chinese literature from the second century BCE through the eighteenth century CE. No prior Chinese language study required.In translation",Spring 2025,"IS, International Studies, LA, Literary/Artistic Analysis","ASST Arts & Literature, ASST East Asia, EAST Supporting, ENGL Foreign Literature, CL: 200 level",,Lei Yang,"T, TH",Language & Dining Center 104,10:10am-11:55am,
CHIN 358,Advanced Chinese: Everyday Life in Ancient China,6 credits,"Were chopsticks originally eating utensils? Did ancient Chinese sleep on beds and sit on chairs? What did they wear? In this course, students will find answers to questions like those in a series of expository writings concerning various aspects of daily life in ancient Chinese society, while enhancing their proficiency in comprehending authentic materials and producing extended discourse on related topics through a variety of oral and written coursework. This course also provides a fair amount of exposure to common sources for historical studies of China, and thus expands students’ vocabulary and knowledge about Chinese history and archaeology.",Spring 2025,"IS, International Studies, LA, Literary/Artistic Analysis",CL: 300 level,Student has completed any of the following course(s):CHIN 206– Chinese in Cultural Context with a grade of C- or better or satisfied the Chinese language requirement with a Carleton placement exam score of 300.,Lin Deng,"M, W",Library 305,12:30pm-1:40pm,
CLAS 123,Greek Archaeology and Art,6 credits,"This course explores the archaeology and art of the Ancient Greek world. Beginning with prehistory, we will track the development of the material culture of Ancient Greece through the Classical and Hellenistic periods, and conclude by discussing aspects of the Roman, Byzantine, and Ottoman empires that followed. We will focus throughout on aspects of archaeological practice, material culture and text, art and society, long-term social change, and the role of the past in the present.",Spring 2025,"CX, Cultural/Linguistics, HI, Humanistic Inquiry, IS, International Studies, QRE, Quantitative Reasoning","ARTH Pertinent, ARTH Pre-1800, CLAS Civ Archaeologcl Anlys, CL: 100 level, ARCN Pertinent",,Alex Knodell,"M, W",Language & Dining Center 104,12:30pm-1:40pm,
CLAS 142,"“No, Luke, I am your father!”: Being an Heir in the Ancient Family",6 credits,"The bond between fathers and sons is prominent in cinematic sagas, fromStarWarstoTheLion King. But is it only a modern concern? What can Greek literature teach us about this relationship in today’s societies? This course explores the literary representations of ancient heroic families and traces their portrayals through the works of Homer, Aeschylus, Sophocles, Euripides, and Aristophanes. We will discuss the context and aims of Greek epic, tragedies and comedies, and investigate the representation of familial legacy, examining how sons can shape their own identity and emerge from their parents’ shadows, both then and now.",Spring 2025,"LA, Literary/Artistic Analysis","CLAS Civ Literary Anlys, CLAS Core, CL: 100 level",,Cecilia Cozzi,,,,
CLAS 214,Gender and Sexuality in Classical Antiquity,6 credits,"In both ancient Greece and Rome, gender (along with class and citizenship status) largely determined what people did, where they spent their time, and how they related to others. This course will examine the ways in which Greek and Roman societies defined gender categories, and how they used them to think about larger social, political, and religious issues. Primary readings from Greek and Roman epic, lyric, and drama, as well as ancient historical, philosophical, and medical writers; in addition we will explore a range of secondary work on the topic from the perspectives of Classics and Gender Studies.",Spring 2025,"CX, Cultural/Linguistics, HI, Humanistic Inquiry, IS, International Studies, QRE, Quantitative Reasoning, WR2 Writing Requirement 2","CLAS Civ Literary Anlys, GWSS Elective, CL: 200 level",,Clara Hardy,"T, TH",Language & Dining Center 104,1:15pm-3:00pm,
CLAS 240,Rome: From Village to Superpower,6 credits,"This class will investigate how Rome rose from a humble village of outcasts and refugees to become the preeminent power in the entire Mediterranean. We will trace Rome’s political evolution from kings to the Republic, alongside their gradual takeover of the Italian peninsula. We will study how Rome then swiftly overpowered what had been the most powerful kingdoms in the Mediterranean and established themselves as dominant. Who were these Romans and what were their political, military, religious, and social systems that enabled them to accomplish so much? What critical events shaped their development and ultimately led to total political control of the Mediterranean world?",Spring 2025,"CX, Cultural/Linguistics, HI, Humanistic Inquiry, IS, International Studies","CLAS Civ Historical Anlys, HIST Ancient & Medvl, HIST Pre-Modern, CL: 200 level",,Jake Morton,"M, W",Language & Dining Center 104,1:50pm-3:00pm,
CS 111,Introduction to Computer Science,6 credits,"This course will introduce you to computer programming and the design of algorithms. By writing programs to solve problems in areas such as image processing, text processing, and simple games, you will learn about recursive and iterative algorithms, complexity analysis, graphics, data representation, software engineering, and object-oriented design. No previous programming experience is necessary.",Spring 2025,"FSR, Formal or Statistical Reasoning, QRE, Quantitative Reasoning","CGSC Core, CS Required for Major, DGAH Skill Building, STAT Supporting, PHYS Addl Recommended, CL: 100 level, No Prerequisites",NOT open to students who have completed any of the following course(s):CS 201or greater with a grade of C- or better.,Tom Finzell,"M, W",Olin 310,8:30am-9:40am,
CS 201,Data Structures,6 credits,"Think back to your favorite assignment from Introduction to Computer Science. Did you ever get the feeling that “there has to be a better/smarter way to do this problem”? The Data Structures course is all about how to store information intelligently and access it efficiently. How can Google take your query, compare it to billions of web pages, and return the answer in less than one second? How can one store information so as to balance the competing needs for fast data retrieval and fast data modification? To help us answer questions like these, we will analyze and implement stacks, queues, trees, linked lists, graphs, and hash tables. Students who have received credit for a course for which Computer Science 201 is a prerequisite are not eligible to enroll in Computer Science 201.",Spring 2025,"FSR, Formal or Statistical Reasoning, QRE, Quantitative Reasoning","CS Required for Major, CL: 200 level",Student has completed any of the following course(s):CS 111– Introduction to Computer Science with a grade of C- or better or a score of 4 or better on the Computer Science A AP exam or equivalent.Not open to students that have takenCS 200– Data Structures with Problem Solving.,Tanya Amert,"M, W",Olin 310,11:10am-12:20pm,
CS 202,Mathematics of Computer Science,6 credits,"This course introduces some of the formal tools of computer science, using a variety of applications as a vehicle. You’ll learn how to encode data so that when you scratch the back of a DVD, it still plays just fine; how to distribute “shares” of your floor’s PIN so that any five of you can withdraw money from the floor bank account (but no four of you can); how to play chess; and more. Topics that we’ll explore along the way include: logic and proofs, number theory, elementary complexity theory and recurrence relations, basic probability, counting techniques, and graphs.",Spring 2025,"FSR, Formal or Statistical Reasoning","CS Required for Major, LING Related Field, CL: 200 level",Student has completed any of the following course(s):CS 111– Introduction to Computer Science with a grade of C- or better or received a score of 4 or better on the AP Computer Science exam ANDMATH 101– Calculus with Problem Solving orMATH 111– Introduction to Calculus or greater with a grade of C- or better or greateror received a score of 4 or better on the Calculus AB AP exam or received a score of 4 or better on the Calculus BC AP exam or received a score of 5 or better on the Mathematics IB exam or equivalent.,Eric Alexander,"M, W",Anderson Hall 329,12:30pm-1:40pm,
CS 208,Introduction to Computer Systems,6 credits,"Are you curious what’s really going on when a computer runs your code? In this course we will demystify the machine and the tools that we use to program it. Our broad survey of how computer systems execute programs, store information, and communicate will focus on the hardware/software interface, including data representation, instruction set architecture, the C programming language, memory management, and the operating system process model.",Spring 2025,"FSR, Formal or Statistical Reasoning","CS Required for Major, CL: 200 level",Student has completed any of the following course(s):CS 200– Data Structures with Problem Solving orCS 201– Data Structures with a grade of C- or better or equivalent.,Tanya Amert,"M, W",Leighton 305,1:50pm-3:00pm,
CS 251,Programming Languages: Design and Implementation,6 credits,"What makes a programming language like “Python” or like “Java”? This course will look past superficial properties (like indentation) and into the soul of programming languages. We will explore a variety of topics in programming language construction and design: syntax and semantics, mechanisms for parameter passing, typing, scoping, and control structures. Students will expand their programming experience to include other programming paradigms, including functional languages like Scheme and ML.",Spring 2025,"FSR, Formal or Statistical Reasoning","CS Required for Major, CL: 200 level",Student has completed any of the following course(s):CS 200– Data Structures with Problem Solving orCS 201– Data Structures with a grade of C- or better or equivalent.,David Musicant,"M, W",Language & Dining Center 104,9:50am-11:00am,
CS 252,Algorithms,6 credits,"A course on techniques used in the design and analysis of efficient algorithms. We will cover several major algorithmic design paradigms (greedy algorithms, dynamic programming, divide and conquer, and network flow). Along the way, we will explore the application of these techniques to a variety of domains (natural language processing, economics, computational biology, and data mining, for example). As time permits, we will include supplementary topics like randomized algorithms, advanced data structures, and amortized analysis.",Spring 2025,"FSR, Formal or Statistical Reasoning","CS Required for Major, MATH Discrete Structures, MATH Electives, SDSC CS Elective, CL: 200 level",Student has completed any of the following course(s):CS 200– Data Structures with Problem Solving orCS 201– Data Structures ANDCS 202– Mathematics of Computer Science orMATH 236– Mathematical Structures with a grade of C- or better or equivalent.MATH 236will be accepted in lieu of Computer Science 202.,Eric Alexander,"M, W",Hulings 316,9:50am-11:00am,
CS 254,Computability and Complexity,6 credits,"An introduction to the theory of computation. What problems can and cannot be solved efficiently by computers? What problems cannot be solved by computers, period? Topics include formal models of computation, including finite-state automata, pushdown automata, and Turing machines; formal languages, including regular expressions and context-free grammars; computability and uncomputability; and computational complexity, particularly NP-completeness.",Spring 2025,"FSR, Formal or Statistical Reasoning","CGSC Elective, CS Required for Major, LING Pertinent, LING Related Field, MATH Discrete Structures, MATH Electives, NEUR Elective, CL: 200 level",Student has completed any of the following course(s):CS 200– Data Structures with Problem Solving orCS 201– Data Structures ANDCS 202– Mathematics of Computer Science orMATH 236– Mathematical Structures with a grade of C- or better or equivalent.MATH 236will be accepted in lieu of Computer Science 202.,Layla Oesper,"M, W",Hulings 316,12:30pm-1:40pm,
CS 257,Software Design,6 credits,"It’s easy to write a mediocre computer program, and lots of people do it. Good programs are quite a bit harder to write, and are correspondingly less common. In this course, we will study techniques, tools, and habits that will improve your chances of writing good software. While working on several medium-sized programming projects, we will investigate code construction techniques, debugging and profiling tools, testing methodologies, UML, principles of object-oriented design, design patterns, and user interface design.",Spring 2025,"FSR, Formal or Statistical Reasoning","CS Required for Major, SDSC CS Elective, CL: 200 level",Student has completed any of the following course(s):CS 200– Data Structures with Problem Solving orCS 201– Data Structures with a grade of C- or better or equivalent.,Jeff Ondich,"M, W",Anderson Hall 329,8:30am-9:40am,
CS 304,Social Computing,6 credits,"The last decade has seen a vast increase in the number of applications that connect people with one another. This course presents an interdisciplinary introduction to social computing, a field of study that explores how computational techniques and artifacts are used to support and understand social interactions. We will examine a number of socio-technical systems (such as wikis, social media platforms, and citizen science projects), discuss the design principles used to build them, and analyze how they help people mobilize and collaborate with one another. Assignments will involve investigating datasets from online platforms and exploring current research in the field.",Spring 2025,"FSR, Formal or Statistical Reasoning, QRE, Quantitative Reasoning",CL: 300 level,Student has completed any of the following course(s):CS 200– Data Structures with Problem Solving orCS 201– Data Structures with a grade of C- or better or equivalent.,Sneha Narayan,"M, W",Anderson Hall 323,12:30pm-1:40pm,
CS 311,Computer Graphics,6 credits,"Scientific simulations, movies, and video games often incorporate computer-generated images of fictitious worlds. How are these worlds represented inside a computer? How are they “photographed” to produce the images that we see? What performance constraints and design trade-offs come into play? In this course we learn the basic theory and methodology of three-dimensional computer graphics, including both triangle rasterization and ray tracing. Familiarity with vectors and matrices is recommended but not required.",Spring 2025,"FSR, Formal or Statistical Reasoning, QRE, Quantitative Reasoning",CL: 300 level,Student has completed any of the following course(s):CS 208– Intro to Computer Systems with grade of C- or better.,Josh Davis,"M, W",Leighton 305,9:50am-11:00am,
CS 320,Machine Learning,6 credits,"What does it mean for a machine to learn? Much of modern machine learning focuses on identifying patterns in large datasets and using these patterns to make predictions about the future. Machine learning has impacted a diverse array of applications and fields, from scientific discovery to healthcare to education. In this artificial intelligence-related course, we’ll both explore a variety of machine learning algorithms in different application areas, taking both theoretical and practical perspectives, and discuss impacts and ethical implications of machine learning more broadly. Topics may vary, but typically focus on regression and classification algorithms, including neural networks.",Spring 2025,"FSR, Formal or Statistical Reasoning","CGSC Elective, STAT Elective, SDSC CS Elective, CL: 300 level",Student has completed any of the following course(s):CS 200– Data Structures with Problem Solving orCS 201– Data Structures ANDCS 202– Mathematics of Computer Science orMATH 236– Mathematical Structures with a grade of C- or better or equivalent.MATH 236will be accepted in lieu of Computer Science 202.,Tom Finzell,"M, W",Language & Dining Center 104,11:10am-12:20pm,
CS 347,Advanced Software Design,6 credits,"This course helps students to strengthen their ability to design modular, extensible and maintainable software. The focus of the course is on the design of modern cloud applications. Students will learn how to decompose complex applications into a set of back-end services, develop and debug these services, and deploy them in the cloud. This class is structured around a large project that will be extended over the course of the term.",Spring 2025,"FSR, Formal or Statistical Reasoning","CS Major Electives, CL: 300 level",Student has completed any of the following course(s): CS – 257 – Software Design with a grade of C- or better or equivalent.,Jeff Ondich,"M, W",Anderson Hall 323,11:10am-12:20pm,
CS 348,Parallel and Distributed Computing,6 credits,"As multi-core machines become more prevalent, different programming paradigms have emerged for harnessing extra processors for better performance. This course explores parallel computation for both shared memory and distributed parallel programming paradigms. In particular, we will explore how these paradigms affect the code we write, the libraries we use, and the advantages and disadvantages of each. Topics will include synchronization primitives across these models for parallel execution, debugging concurrent programs, fork/join parallelism, example parallel algorithms, computational complexity and performance considerations, computer architecture as it relates to parallel computation, and related theory topics.",Spring 2025,"FSR, Formal or Statistical Reasoning","SDSC CS Elective, CL: 300 level",Student has completed any of the following course(s):CS 200– Data Structures with Problem Solving orCS 201– Data Structures with a grade of C- or better or equivalent.,David Musicant,"M, W",Anderson Hall 329,1:50pm-3:00pm,
CS 361,Artificial Life and Digital Evolution,6 credits,"The field of artificial life seeks to understand the dynamics of life by separating them from the substrate of DNA. In this course, we will explore how we can implement the dynamics of life in software to test and generate biological hypotheses, with a particular focus on evolution. Topics will include the basic principles of biological evolution, transferring experimental evolution techniques to computational systems, cellular automata, computational modeling, and digital evolution. All students will be expected to complete and present a term research project recreating and extending recent work in the field of artificial life.",Spring 2025,"FSR, Formal or Statistical Reasoning","CGSC Elective, CL: 300 level",Student has completed any of the following course(s):CS 200– Data Structures with Problem Solving orCS 201– Data Structures with a grade of C- or better or equivalent.,Anya Vostinar,"M, W",Olin 304,8:30am-9:40am,
DANC 107,Ballet I,1 credits,"A beginning course in ballet technique, including basic positions, beginning patterns and exercises. Students develop an awareness of the many ways their body can move, an appreciation of dance as an artistic expression and a recognition of the dancer as an athlete.",Spring 2025,"ARP, Arts Practice, PE, Physical Education",DANC Movmnt Practic Perform,,Jennifer Bader,"M, W",Weitz Center 168,9:50am-11:00am,
DANC 148,Modern Dance I: Technique and Theory,1 credits,"A physical exploration at the introductory level of the elements of dance: time, motion, space, shape and energy. Students are challenged physically as they increase their bodily awareness, balance, control, strength and flexibility and get a glimpse of the art of dance.",Spring 2025,"ARP, Arts Practice, PE, Physical Education",DANC Movmnt Practic Perform,,Daphne McCoy,"T, TH",Weitz Center 165,9:20am-10:30am,
DANC 190,Fields of Performance,6 credits,"This introductory course in choreography explores games, structures, systems and sports as sources and locations of movement composition and performance. Readings, viewings and discussion of postmodernist structures and choreographers as well as attendance and analysis of dance performances and sports events will be jumping off point for creative process and will pave the way for small individual compositions and one larger project. In an atmosphere of play, spontaneity and research participants will discover new ways of defining dance, pushing limits and bending the rules. Guest choreographers and coaches will be invited as part of the class. Open to all movers. No previous experience necessary.",Spring 2025,"ARP, Arts Practice","DANC Choreography, CL: 100 level",,Judith Howard,"T, TH",Weitz Center 165,1:15pm-3:00pm,
