Course_1,Course_2,Description_1,Description_2,Similarity,Markus_Score,Charlie_Score,Tiebreak
EDUC 338,HIST 111,"This course focuses on the respect for human diversity, especially as these relate to various racial, cultural and economic groups, and to women. It includes lectures and discussions intended to aid students in relating to a wide variety of persons, cultures, and life styles.Extra time","This course introduces students to maritime history, marine environmental history, and issues in contemporary marine policy. While traditional histories have framed the sea as an empty space and obstacle to be traversed, or as a battleground, we will approach the ocean as a contact zone, a space of labor, and as the site of focused scientific research, thereby emphasizing human interaction with the oceans. We will examine how people have come to know, utilize, and govern the world’s oceans across time and space, and we will explore how this history informs contemporary issues in maritime law, governance, and ocean conservation.",0.676488,1,0,0
STAT 285,HIST 116,"Students will apply their statistical knowledge by analyzing data problems solicited from the Northfield community. Students will also learn basic consulting skills, including communication and ethics.All interested students are encouraged to add to the waitlist and the instructor will reach out after registration. This course is repeatable, but if the instructor cannot admit every student on the waitlist, priority will be given first to Statistics majors who have not previously taken the course and then to other students who have not taken the course.","Many Americans grow up with a fictionalized view of Indigenous people (sometimes also called Native Americans/American Indians, Alaska Natives, and Native Hawaiians within the U.S. context). Understanding Indigenous peoples’ histories, presents, and possible futures requires moving beyond these stereotypes and listening to Indigenous perspectives. In this class, we will begin to learn about Indigenous peoples across Turtle Island and the Pacific through tribal histories, legislation, Supreme Court cases, and personal narratives. The course will focus on the period from 1887 to 2018 with major themes including (among others) agency, resistance, resilience, settler colonialism, discrimination, and structural racism.",0.12022545,0,0,
GRK 226,ENGL 109,"Greek literature abounds in stories of hostile encounters between heroes and monsters. Perseus vs. Medusa, Theseus and the Minotaur, Bellerophon vs. the Chimera are only a few of these stories that feature larger-than-life individuals who confront otherworldly creatures. But why is there such a fascination in the Greek mind? In this course, we will examine such stories in the original Greek, looking at authors such as Homer, Hesiod, Herodotus, and Lucian, and we will discuss what the socio-cultural constructions of theheroand themonstershow us about what it means to be human both in antiquity and in modern times.","This course is designed to demystify the practice of academic writing and to introduce students to the skills they’ll need to write effectively in a variety of academic disciplines and contexts. Students will learn how to respond to other authors’ claims, frame clear arguments of their own, structure essays to develop a clear logical flow, integrate outside sources into their writing, and improve their writing through revision. All sections will include a variety of readings, multiple writing assignments, and substantial feedback from the course instructor.",0.1731022,1,0,0
CAMS 272,AMST 396.00,"Narrative films are the product of many artists working in concert toward a shared artistic vision. In this course, students will explore the essential crew roles on narrative films and choose an area in which they would like to specialize during the making of a collaborative project in Los Angeles. In addition to a focus on story and directing actors, specialized equipment and craft labs will expand students' technical skills. Through the term, students will learn the ins-and-outs of filmmaking in Los Angeles while moving through production of a narrative short film, with each student taking on a specific crew position in a collaborative project.Open only to participants in Carleton OCS CAMS Production in Los Angeles Program","As Arlene Dávila points out inLatinos Inc, Latinidad—the term that names a set of presumably common attributes that connects Latinxs in the U.S.—emerges in part from communities but, importantly, is developed heavily by the media, advertising, and other political and social institutions, including academia. In this course we consider how ideas and imaginings of who Latinxs are and what Latinidad is develop within political spaces (the electorate, the census), in local places, and through various media, including television, advertising, and music. We will consider how individual writers and artists contribute to the conversation. Throughout, we will engage with social and cultural theories about racial formation, gender, and sexuality.",-0.016702231,1,1,
RUSS 103,ARTS 113,Concludes introductory method of Russian 101-102.,"A beginning drawing course for students who are interested in developing their skills in drawing from nature, to better see and understand their surroundings. Class material covers line, form, dimension, value, perspective, and space using a variety of drawing materials. Subject matter includes specimens, plant forms, and the landscape. Students will use a portable sketchbook, and classes during the second part of the term are primarily outside. Locations include the Arb and field trips; access to these sites does include walking on unpaved paths and uneven terrain.Sophomore Priority;Two seats held for Art and Art History majors until the day after junior priority registration.",0.43042988,0,0,
ENGL 338,MELA 230,"An intensive study of lyric invention and innovation in the work of Emily Dickinson, Marianne Moore, and Elizabeth Bishop. Starting with formalist readings and historicizing the poetic subjects they pursued in common (self and society, loss and knowledge, nature, gender, the senses, the body), we will explore their practice, reception, and influence in relation to changing Modernist poetics, 1860 to 1970, and to specifics of place: Amherst, Brooklyn, Nova Scotia, Key West, and Brazil.","Judaism emphasizes transmitting memory from one generation to the next. How have pivotal events and experiences in Jewish history lived on in Jewish collective memory? How do they continue to speak through artistic/literary composition and museum/memorial design? How does Jewish collective memory compare with recorded Jewish history? We will study turning points in Jewish history including the Exodus from Egypt, Jewish expulsion from medieval Spain, the Holocaust, and Israeli independence, as Jews in different times and places have interpreted them with lasting influence. Research includes work with print, film, and other visual/ performative media.",0.45647758,0,0,
MUSC 221,PHIL 209,"This course focuses on creating new electronic music. We will use digital audio workstations for composition and production, grounding their use in the fundamentals of digital audio. We will listen extensively, in many genres of electronic music, applying this critical listening to our own work and our colleagues’ work. Frequent composition assignments build fundamental skills in melodic creation and development, drum programming, synthesis, and audio production. The course culminates in a term project, a stylistically unrestricted, substantial original composition.","Ian McKellen explains that when he acts on stage, “I pretend to be the person I’m portraying.” But how do you pretend to be a person? Is it different from playing make-believe or code-switching your behavior between family, friends, and classmates? Is it different from what writers do when they write about fictional people? And just what is a person, anyway? A particular body? A set of beliefs and desires? Is an actor’s race and gender independent of those of the person they portray? We’ll evaluate competing answers to such questions from philosophers, cognitive scientists, and theater practitioners.",0.0380498,0,0,
MATH 241,RELG 155,"Ordinary differential equations are a fundamental language used by mathematicians, scientists, and engineers to describe processes involving continuous change. In this course we develop ordinary differential equations as models of real world phenomena and explore the mathematical ideas that arise within these models. Topics include separation of variables; phase portraits; equilibria and their stability; non-dimensionalization; bifurcation analysis; and modeling of physical, biological, chemical, and social processes.","Hinduism is the world’s third-largest religion (or, as some prefer, “way of life”), with about 1.2 billion followers. It is also one of its oldest, with roots dating back at least 3500 years. “Hinduism,” however, is a loosely defined, even contested term, designating the wide variety of beliefs and practices of the majority of the people of South Asia. This survey course introduces students to this great variety, including social structures (such as the caste system), rituals and scriptures, mythologies and epics, philosophies, life practices, politics, poetry, sex, gender, Bollywood, and—lest we forget—some 330 million gods and goddesses.",0.3551536,1,0,0
RELG 261,EUST 207,"From colonial times when Muslims were brought to America as slaves, to the aftermath of the Spanish-American War when the United States found itself ruling over a large Muslim population in the Philippines, to the more recent War on Terror, Muslims and Islam have long been entangled in the politics of race and empire in America. This course will examine these entanglements through primary and secondary sources to better understand the role that race, religion, and empire have played in the forging of American Islam today.","Through a range of interdisciplinary readings, guest lectures, and site visits, this course will provide students with opportunities to analyze important aspects of Italian culture and society, both past and present, as well as to examine the ways in which travelers, tourists, temporary visitors, and immigrants have experienced and coped with their Italian worlds. Topics may include transportation, cuisine, rituals and rhythms of Italian life, urbanism, religious diversity, immigration, tourism, historic preservation, and language. Class discussions and projects will offer students opportunities to reflect on their own encounters with contemporary Italian culture.Open only to participants in OCS Rome Program",0.36440283,1,0,1
LING 319,ECON 269,"Participants in this course learn how to design and conduct sociolinguistic research, with a focus on the varieties of English spoken in Minnesota. After an introduction to the quantitative sociolinguistic methods used to obtain large data sets of naturalistic speech (publicly available data, online questionnaires, individual and group interviews, and ethnography), participants design studies investigating the status of a phonetic or phonological linguistic variable typically attributed to regional Englishes. The course culminates in a pilot study assessing the status of these variables in the speech of Minnesotans.","This course studies the relationship between climate change, government policy, and global markets. It explores the historical relationship between economic growth and greenhouse gasses, the cost-benefit analysis of policies aimed at reducing greenhouse gas emissions, and the potential for adaptation to climate change. Through readings, discussions, and case studies, students will gain a deep understanding of the economic implications of climate change and the policies that can be used to mitigate its effects. By the end of the course, students will have developed a critical understanding of the complex relationship between economics and climate change and will be equipped to engage in meaningful discussions and analysis of this pressing global issue.",-0.13297643,0,0,
CS 252,ASST 285,"A course on techniques used in the design and analysis of efficient algorithms. We will cover several major algorithmic design paradigms (greedy algorithms, dynamic programming, divide and conquer, and network flow). Along the way, we will explore the application of these techniques to a variety of domains (natural language processing, economics, computational biology, and data mining, for example). As time permits, we will include supplementary topics like randomized algorithms, advanced data structures, and amortized analysis.","From ancient to present times, Japan drew and redrew its borders, shape, and culture, imagining its place in this world and beyond, its cultural and racial identity. This course is a cartographic exploration of this complex and contested history. Cosmological mandalas, hell images, travel brochures, and military maps bring to light the imagined Japan—its religious vision, cartographic imagination, and political ambition—that dictated its geopolitical expansion abroad and the displacement of minority peoples “at home.” We will use a variety of textual and visual materials, including those in Carleton’s Rare Book and Map Collections.",-0.011000652,0,0,
BIOL 241,HIST 276,Requires concurrent registration in Biology 240,"Even while still on the campaign trail, Spain’s conquistadors endeavored to describe Mexico's native societies to other Europeans. Thus began a centuries-long fascination with all things Mesoamerican, real and imaginary. This course explores how the Mesoamerican past has been imagined by indigenous and non-indigenous people. Potential subjects include Spanish conquistadors and missionaries, early Mexican nation-builders and artists, professional and pseudo-archaeologists, apocalyptic doomsayers, promoters of the Mexican tourist industry, and the counterculture and Chicano movements of the 1960s. Importantly, we will also consider how Mexico's indigenous groups have come to understand their own past from the time of Spanish rule to the present day.",0.3538564,0,0,
POSC 170,ECON 330,"What are the foundational theories and practices of international relations and world politics? This course addresses topics of a geopolitical, commercial and ideological character as they relate to global systems including: great power politics, polycentricity, and international organizations. It also explores the dynamic intersection of world politics with war, terrorism, nuclear weapons, national security, human security, human rights, and the globalization of economic and social development.",An analysis of the forces determining relative prices within the framework of production and distribution. This class is normally taken by juniors. Sophomores considering enrolling should speak to the instructor.,0.06778328,0,0,
RELG 344,EDUC 110,"The practices of popular, or local, or lived religion in American culture often blur the distinction between the sacred and profane and elude religious studies frameworks based on the narrative, theological, or institutional foundations of “official” religion. This course explores American religion primarily through the lens of the practices of lived religion with respect to ritual, the body, the life cycle, the market, leisure, and popular culture. Consideration of a wide range of topics, including ritual healing, Christmas, cremation, and Elvis, will nourish an ongoing discussion about how to make sense of lived religion.","This course will focus on education as a multidisciplinary field of study. We will explore the meanings of education within individual lives and institutional contexts, learn to critically examine the assumptions that writers, psychologists, sociologists and philosophers bring to the study of education, and read texts from a variety of disciplines. What has “education” meant in the past? What does “education” mean in contemporary American society? What might “education” mean to people with differing circumstances and perspectives? And what should “education” mean in the future? Open only to first-and second-year students.",0.4647452,0,0,
HIST 251,GRK 226,"This course examines Japanese and European history from c. 1500 to 1900, tracking the disparate ways in which these regions changed over this time period and highlighting their entanglement. We will focus on three modules, each centered on the era when European global expansion was at its peak and when Japan was isolationist. We will explore developments in regional and global trade networks and state and financial institutions, in addition to news networks, the world of publishing, and the social world of intellectual exchange. Finally, the course compares changing views and practices in the fields of science and medicine.","Greek literature abounds in stories of hostile encounters between heroes and monsters. Perseus vs. Medusa, Theseus and the Minotaur, Bellerophon vs. the Chimera are only a few of these stories that feature larger-than-life individuals who confront otherworldly creatures. But why is there such a fascination in the Greek mind? In this course, we will examine such stories in the original Greek, looking at authors such as Homer, Hesiod, Herodotus, and Lucian, and we will discuss what the socio-cultural constructions of theheroand themonstershow us about what it means to be human both in antiquity and in modern times.",0.32860085,0,0,
ECON 269,POSC 201,"This course studies the relationship between climate change, government policy, and global markets. It explores the historical relationship between economic growth and greenhouse gasses, the cost-benefit analysis of policies aimed at reducing greenhouse gas emissions, and the potential for adaptation to climate change. Through readings, discussions, and case studies, students will gain a deep understanding of the economic implications of climate change and the policies that can be used to mitigate its effects. By the end of the course, students will have developed a critical understanding of the complex relationship between economics and climate change and will be equipped to engage in meaningful discussions and analysis of this pressing global issue.","This course covers the science and art of statecraft, which is the application of the tools of national power. Students will study how nations use diplomatic, economic, and military power to achieve stated national policy objectives. The course is team-taught by three career national security professionals. Case studies are used to assess the application of diplomatic, economic, and military power in the real world. Course readings, papers, and significant classroom discussion will deliver content to students and set the stage for the International Strategic Crisis Negotiation Exercise, which is a graded part of the course.Not open to first years.",0.7432556,1,0,1
ENGL 230,CAMS 186,"We will explore developments in African American literature since the 1950s with a focus on literary expression in the Civil Rights Era; on the Black Arts Movement; on the new wave of feminist/womanist writing; and on the experimental and futuristic fictions of the twenty-first century. Authors to be read include Ralph Ellison, James Baldwin, Lorraine Hansberry, Malcolm X, Audre Lorde, Amiri Baraka, Ishmael Reed, Alice Walker, August Wilson, Charles Johnson, Ntozake Shange, Gloria Naylor, Suzan-Lori Parks, Kevin Young, and Tracy Smith.","In this course we survey four or more Hollywood film genres, including but not limited to the Western, musical, horror film, comedy, and science-fiction film. What criteria are used to place a film in a particular genre? What role do audiences and studios play in the creation and definition of film genres? Where do genres come from? How do genres change over time? What roles do genres play in the viewing experience? What are hybrid genres and subgenres? What can genres teach us about society? Assignments aim to develop skills in critical analysis, research and writing.Sophomore Priority Extra Time for Evening screenings",-0.024173832,1,0,0
GERM 103,CHIN 206,"Continuation of the study of complex structural patterns of the German language, and the reading and discussion of longer texts, films, and other media from German-speaking cultures.Students with course conflicts with a 5 day German language course can register for different sections for MWF and TTH sections. Use this form: https://www.carleton.edu/committees/academic-standing/petitions/forms/add-drop-card/","This course advances students’ proficiency in oral and written Chinese, at the same time integrating elements of traditional Chinese civilization and modern Chinese society. Emphasis is on cultural understanding and appropriate language use.",0.5026223,0,1,1
CLAS 240,POSC 266,"This class will investigate how Rome rose from a humble village of outcasts and refugees to become the preeminent power in the entire Mediterranean. We will trace Rome’s political evolution from kings to the Republic, alongside their gradual takeover of the Italian peninsula. We will study how Rome then swiftly overpowered what had been the most powerful kingdoms in the Mediterranean and established themselves as dominant. Who were these Romans and what were their political, military, religious, and social systems that enabled them to accomplish so much? What critical events shaped their development and ultimately led to total political control of the Mediterranean world?","City revenue is increasingly dependent on tourism. Cities manufacture identity and entertainment, whether we think of Las Vegas or Jerusalem, Berlin or Bilbao, the ethnoscapes of Copenhagen or the red light district of Amsterdam. As cities compete in the global economy to become playgrounds for a transnational tourist class, what is the role of urban residents? Who governs? Who benefits? Short essays or exams will be required.",0.5666606,1,1,
HIST 298,GRK 102,"In the junior year, majors must take this six-credit reading and discussion course taught each year by different members of the department faculty. The course is also required for the History minor. The general purpose of History 298 is to help students reach a more sophisticated understanding of the nature of history as a discipline and of the approaches and methods of historians. A major who is considering off-campus study in the junior year should consult with their adviser on when to take History 298.Required for History majors and minors","Study of essential forms and grammar, with reading of original, unadapted passages.",0.30577666,0,0,
DANC 107,HIST 209,"A beginning course in ballet technique, including basic positions, beginning patterns and exercises. Students develop an awareness of the many ways their body can move, an appreciation of dance as an artistic expression and a recognition of the dancer as an athlete.","This course explores the history of enslavement in the Atlantic World, including West Africa, South America, the Caribbean, North America, and Europe. The course examines the intersecting themes of power, labor, law, race, gender, sexuality, and resistance. It will consider how these themes each shaped the construction of different institutions of enslavement while simultaneously focusing on the experiences of the enslaved who lived and died within in these systems. Using a comparative methodology, we will ask canonical questions, such as what constitutes a slave society and which forms did resistance, rebellion, and revolution by enslaved people take.",0.090052,0,0,
RUSS 267,FREN 245,"Against the backdrop of the Napoleonic Wars, Lev Tolstoy challenges readers to confront some of the most confounding questions of human existence: How can we reconcile the notion of free will with the seemingly ineluctable forces of history? Is individual moral action possible in war? How can we live a meaningful life in the face of inevitable death? And what might lie after death? In this course we readWar and Peacein its cultural and historical context, while also considering how it continues to be relevant to our lives today. Conducted in English. No knowledge of Russian literature or history required.2nd 5 weeks, in translation","Reading and discussion of literary works, with analysis of social, historical and political issues, with an emphasis on cultural and literary movements such as Négritude (El Negrismo, in Cuba) and their role in shaping ideas of self-determination, Nationalism and Independence in the French colonies of the Caribbean and Black Africa. We will read works by Aimé Césaire (Martinique), Léopold Sédar Senghor (Senegal), Léon Gontran Damas (French Guiana), Jacques Roumain (Haîti), Laye Camara (Guinea), Mongo Béti (Cameroun), Simone Schwartz-Bart (Guadeloupe) and Alain Mabanckou (Congo). Conducted in French.",0.1325637,0,1,1
