Course_1,Course_2,Description_1,Description_2,Similarity,Markus_Score,Charlie_Score,Tiebreak
POSC 302,HIST 205,"How do social and political groups interact? How do we understand these interactions in relation to power? This course will introduce the basic approaches and debates in the study of prejudice, racial attitudes, and intergroup relations. We will focus on three main questions. First, how do we understand and study prejudice and racism as they relate to U.S. politics? Second, how do group identities, stereotyping, and other factors help us understand the legitimation of discrimination, group hierarchy, and social domination? Third, what are the political and social challenges associated with reducing prejudice?","Environmental concerns, conflicts, and change mark the course of American history, from the distant colonial past to our own day. This course will consider the nature of these eco-cultural developments, focusing on the complicated ways that human thought and perception, culture and society, and natural processes and biota have all combined to forge Americans’ changing relationship with the natural world. Topics will include Native American subsistence strategies, Euroamerican settlement, industrialization, urbanization, consumption, and the environmental movement. As we explore these issues, one of our overarching goals will be to develop an historical context for thinking deeply about contemporary environmental dilemmas.",0.45945507,1,1,
RUSS 309,POSC 160,This course aims at skill development in speaking and oral presentation as well as in limited forms of composition. It is taken in combination with Russian 307 and conducted by members of Kazakh National University Philological Faculty and supervised by the program director. Expected preparation: 6 credits of Russian at the 300 level.Open only to participants in Carleton OCS Russophone Studies in Central Asia program,"Introduction to ancient and modern political philosophy. We will investigate several fundamentally different approaches to the basic questions of politics–questions concerning the character of political life, the possibilities and limits of politics, justice, and the good society–and the philosophic presuppositions (concerning human nature and human flourishing) that underlie these, and all, political questions.",-0.102243096,0,0,
ARTS 262,LING 115,"This course provides an introduction to the medium of watercolor painting and gouache (opaque water-based paint) on paper surfaces. Students will develop an understanding of basic color interactions and a wide spectrum of paint application strategies from meticulous refined brushwork to fluid, expressive markmaking.Two seats held for Art and Art History majors until the day after junior priority registration.","This course is organized to enable the student to actively participate in the construction of a rather elaborate theory of the nature of human cognitive capacity to acquire and use natural languages. In particular, we concentrate on one aspect of that capacity: the unconscious acquisition of a grammar that enables a speaker of a language to produce and recognize sentences that have not been previously encountered. In the first part of the course, we concentrate on gathering notation and terminology intended to allow an explicit and manageable description. In the second part, we depend on written and oral student contributions in a cooperative enterprise of theory construction.",0.47663286,0,0,
HEBR 102,JAPN 343,"This course is for students who have completed Hebrew 101 or whose test scores indicate that this is an appropriate level of placement. We continue expanding our vocabulary and grammar knowledge, integrating listening, speaking, reading, and writing in Hebrew. We also continue working with Israeli films and internet, particularly for a Karaoke in Hebrew group project which involves learning and performing an Israeli pop song and researching the artists’ background and messages for a class presentation.","This course examines Japanese popular media through an environmental lens, spanning from the thireteenth century to the present. It explores how novels, films, and animation depict the evolving human relationship with the non-human world amidst political, cultural, and philosophical shifts. Topics include modernization, internal colonization, gender dynamics, and industrial disasters, with a focus on canonical authors and global issues. Students develop skills in cultural comprehension through discussions and written assignments.",0.38047734,0,0,
DANC 279,ARCN 112,"Tap is an energetic form of dance that focuses on rhythm and percussion. Classes will include across the floor exercises that teach dynamics, shading, phrasing, and musicality along with extended rhythmic phrases and improvisation exercises. Tap dance originated in the southern United States as a fusion of West African dance roots and Europeanist influences. In this course students will learn tap skills as well as important aspects of tap dance history. Some previous experience with Tap dance is recommended.","When did humans first migrate to North America? How long have people lived in Minnesota? This course will examine the material culture of Indigenous peoples throughout the North American continent above Mexico, from c. 20,000 years ago to present. Cultural groups include the Inuit, Iroquois, ancient Puebloans, Cahokia, Great Plains villages, and Pacific Northwest (Kumash) peoples. We will study Indigenous oral histories, genetic data, linguistics, material remains, and ethnohistorical accounts to examine migration, trade, and contact, with an emphasis on decolonization and Indigenous archaeologies.",0.04062769,0,0,
CHEM 362,GEOL 240,"This discussion-based seminar involves critical examination of research literature authored by prominent investigators in the interdisciplinary field of nanochemistry. Learning will draw upon the multiple disciplines of chemistry (physical, analytical, inorganic, and organic), physics, and biology. Includes a focus on the integrative themes of design, size, shape, surface, self-assembly, and defects. Novel and emerging applications in technology, biology, and medicine will be explored.","This applied geophysics course focuses on understanding the near-surface structure of the Earth using a hand-on approach. Students will collect, process, model, and interpret geophysical data using gravitational, magnetic, and seismic methods. Weekly laboratories and one weekend field trip will be required.Extra time for weekend field trip",0.5001553,1,0,1
THEA 245,CGSC 330,"Although many directors begin their artistic careers in some other discipline (usually acting), there is a set of skills particular to the director’s art that is essential to creating life on stage. Central is the ability to translate dramatic action and narrative into the dimensions of theatrical time and space: the always-present challenge of “page to stage.” In this course, students will learn methods of text analysis strategic to this process as well as the rudiments of using that analysis to generate effective staging and powerful acting. Having mastered the fundamentals, students will then explore and enhance their theatrical imagination, that creative mode unique to the medium of live performance. Class time will be devoted to work on three major projects and almost daily exercises.","This seminar will consider recent work in philosophy, cognitive science and linguistics critical of views of human cognition as “disembodied” and Cartesian. Philosophical sources of the early critiques of symbolic AI and “cartesianism” will be considered (Merleau-Ponty, Dewey), as will the enactive (Cuffari, Di Paolo, and De Jaegher) and ecological (Chemero, Cowley, Steffensen) critiques of language, and current work on embodied cognition by Eleanor Rosch, Hubert Dreyfus, John Haugeland, Andy Clark and Evan Thompson. The seminar will include materials relevant to students in philosophy, linguistics, psychology and cognitive science.",0.43375716,0,0,
MUSC 217,FREN 255,"Opera has something for everyone: drama, desire, politics, stagecraft, design. The medium sets life to music and reveals the music within people’s lives. In the spirit of exchange between art and reality, this course looks at the history of opera through a contemporary lens. Centering on a diverse collection of operas—and voices—from past to present, we’ll ask how modern sensibilities animate the music’s production and performance. We’ll bring concepts of relevance, risk, representation, and justice to bear on opera, with attention to media and technology. We’ll listen to recent operatic interpretations and discover how creatives are making opera new.","In this course, students will explore the historical, cultural, social, and religious traces of Islam as they have been woven over time into the modern fabric of French society. Through images drawn from film, photography, television, and museum displays, they will discover the important role this cultural contact zone has played in the French experience. The course will take advantage of the resources of the city of Paris and will include excursions to museums as well as cultural and religious centers.Requires participation in OCS Program: French and Francophone Studies in Paris",0.38412443,1,0,1
ARTS 122,DANC 350,"The ability to build structures that reflect or alter the environment is a basic defining characteristic of our species. In this class we explore creative construction in three dimensions using a variety of media, including plaster, wood, and steel. Using both natural and architectural objects for inspiration, we will examine and manipulate form, space, and expressive content to develop a deeper understanding of this core trait and reawaken our experience of the spaces we inhabit.Sophomore Priority; Three seats held for Art and Art History majors until the first day of sophomore registration.Extra Time Required for field trip","Provides advanced dance students with an intensive opportunity to develop as performers in professional level dances. Skills to be honed are: the dancer as contributor to the process of art-making; defining individual technical and expressive gifts; working in a variety of new technical and philosophical dance frameworks. In addition to regular training during the academic terms, participation in a ""preseason"" rehearsal period before fall term is required. A few pieces of student choreography will be accepted for repertory. The group produces an annual concert, performs in the Twin Cities and makes dance exchanges with other college groups. Recommended Preparation:Admission by audition.Audition required.",0.5467199,0,1,0
CS 254,ARTS 252,"An introduction to the theory of computation. What problems can and cannot be solved efficiently by computers? What problems cannot be solved by computers, period? Topics include formal models of computation, including finite-state automata, pushdown automata, and Turing machines; formal languages, including regular expressions and context-free grammars; computability and uncomputability; and computational complexity, particularly NP-completeness.","This course focuses on lost wax casting, 3D modeling and printing, and stone setting as methods to create jewelry and small sculptural objects in bronze and silver. Specific instruction will be given in the proper use of tools, torches, and other equipment, wax carving, and general metalsmithing techniques. Through the use of 3D modeling software and 3D printing, new technologies will expedite traditional processes allowing for a broad range of metalworking possibilities.Two seats held for Art and Art History majors until the day after junior priority registration.",0.6096126,0,0,
GWSS 200,SPAN 220,"In this course we will examine whether there are feminist and/or queer ways of knowing, the criteria by which knowledge is classified as feminist and the various methods used by feminist and queer scholars to produce this knowledge. Some questions that will occupy us are: How do we know what we know? Who does research? Does it matter who the researcher is? How does the social location (race, class, gender, sexuality) of the researcher affect research? Who is the research for? What is the relationship between knowledge, power and social justice? While answering these questions, we will consider how different feminist and queer studies researchers have dealt with them.","This course focuses on contemporary short stories and short novels. We will read some of the most relevant living authors from Latin America including Carlos Gamerro, Pilar Quintana, Kike Ferrari, Yeniter Poleo, Antonio José Ponte, among others. This will expose students to the most pressing issues in today’s Latin America, ranging from gender, violence, racism, and immigration. We will interview at least one of the authors read during the term and discuss the social implications of their literature in today’s world.In Trans",0.04953022,1,1,
AMST 115,PHIL 119,"This overview of the “interdisciplinary discipline” of American Studies will focus on the ways American Studies engages with and departs from other scholarly fields of inquiry. We will study the stories of those who have been marginalized in the social, political, cultural, and economic life of the United States due to their class, race, ethnicity, gender, sexual orientation, religion, citizenship, and level of ability. We will explore contemporary American Studies concerns like racial and class formation, the production of space and place, the consumption and circulation of culture, and transnational histories.Sophomore Priority","Does life have a meaning? To answer this, we will explore various cross-cultural approaches to the meaning of life, both those that affirm meaning and deny it. We will cover, for example, approaches to the meaning of life grounded in divinity, creativity, striving, and more. We will also inquire into related questions about agency: Is fate compatible with meaning in life? Is meaning distinct from happiness? Is meaning a moralized concept? In addition, there will be room for student choice of topics.",0.2423605,0,0,
CAMS 214,ASTR 233,"This course is designed to introduce students to recent film history, 1970-present, and the multiple permutations of cinema around the globe. The course charts the development of national cinemas since the 1970s while considering the effects of media consolidation and digital convergence. Moreover, the course examines how global cinemas have reacted to and dealt with the formal influence and economic domination of Hollywood on international audiences. Class lectures, screenings, and discussions will consider how cinema has changed from a primarily national phenomenon to a transnational form in the twenty-first century.Extra Time required for evening Screenings.","A study of galactic and extragalactic astronomy with an emphasis on the physical principles underlying the observed phenomena. Topics include the structure and dynamics of the Milky Way Galaxy and other galaxies, the interstellar medium, quasars and active galaxies, clusters and superclusters, and cosmology.",0.48143467,0,0,
ARTS 113,ENGL 109,"A beginning drawing course for students who are interested in developing their skills in drawing from nature, to better see and understand their surroundings. Class material covers line, form, dimension, value, perspective, and space using a variety of drawing materials. Subject matter includes specimens, plant forms, and the landscape. Students will use a portable sketchbook, and classes during the second part of the term are primarily outside. Locations include the Arb and field trips; access to these sites does include walking on unpaved paths and uneven terrain.Sophomore Priority;Two seats held for Art and Art History majors until the day after junior priority registration.","This course is designed to demystify the practice of academic writing and to introduce students to the skills they’ll need to write effectively in a variety of academic disciplines and contexts. Students will learn how to respond to other authors’ claims, frame clear arguments of their own, structure essays to develop a clear logical flow, integrate outside sources into their writing, and improve their writing through revision. All sections will include a variety of readings, multiple writing assignments, and substantial feedback from the course instructor.",0.39653724,0,0,
CAMS 229,PHYS 234,"Los Angeles is well known as the center of the film and television industry. This course will explore the lesser-know experimental and avant-garde cinematic histories and current practices in Los Angeles through readings and screenings. Site visits will include filmmaker and media artist studios, archives, and film festivals. Students will reflect on their experiences with course materials through short writings and creative projects.Open only to participants in Carleton OCS CAMS Production in Los Angeles Program","The development of techniques to study complex physical systems from a probabilistic and numerical standpoint, focused on cellular automata models. Subject material is applicable to all the sciences and mathematics. Some topics considered are random walks, percolation clusters, avalanches, traffic flow, the spread of forest fires and diseases, and a brief introduction to Bayesian statistics. No computer programming skills are assumed.",0.2292825,0,0,
RUSS 307,THEA 209,"This course combines advanced work in Russian grammar, especially morphology and syntax, and fundamentals in composition, with conversational Russian. Expected preparation: Six credits of Russian at the 300 level.Participation in Carleton OCS Russia in Kazakhstan program","This interdisciplinary course, taught in conjunction with a full-scale Carleton Players production, will explore one of Shakespeare’s greatest and most complex works,Twelfth Night. We will investigate the play’s historical, social, and theatrical contexts as we try to understand not only the world that produced the play, but the world that came out of it. How should what we learn of the past inform a modern production? How can performance offer interpretive arguments about the play’s meanings? Mixing embodied and experiential learning, individual and group projects may involve dramaturgy, stagecraft, literary analysis, music, and research in Special Collections.",0.48191586,0,0,
SOAN 262,AMST 115,"An ethnographic approach to beliefs and practices regarding health and illness in numerous societies worldwide. This course examines patients, practitioners, and the social networks and contexts through which therapies are managed to better understand medical systems as well as the significance of the anthropological study of misfortune. Specific topics include the symbolism of models of illness, the ritual management of misfortune and of life crisis events, the political economy of health, therapy management, medical pluralism, and cross-cultural medical ethics.The department strongly recommends that Sociology/Anthropology 110 or 111 be taken prior to enrolling in courses numbered 200 or above.","This overview of the “interdisciplinary discipline” of American Studies will focus on the ways American Studies engages with and departs from other scholarly fields of inquiry. We will study the stories of those who have been marginalized in the social, political, cultural, and economic life of the United States due to their class, race, ethnicity, gender, sexual orientation, religion, citizenship, and level of ability. We will explore contemporary American Studies concerns like racial and class formation, the production of space and place, the consumption and circulation of culture, and transnational histories.Sophomore Priority",0.36399144,0,1,0
HEBR 102,JAPN 206,"This course is for students who have completed Hebrew 101 or whose test scores indicate that this is an appropriate level of placement. We continue expanding our vocabulary and grammar knowledge, integrating listening, speaking, reading, and writing in Hebrew. We also continue working with Israeli films and internet, particularly for a Karaoke in Hebrew group project which involves learning and performing an Israeli pop song and researching the artists’ background and messages for a class presentation.","This course advances students’ proficiency in the four skills of speaking, listening, reading and writing in Japanese. The course also integrates elements of traditional Japanese civilization and modern Japanese society, emphasizing cultural understanding and situationally appropriate language use.",0.7064555,1,0,1
NEUR 239,RELG 155,This laboratory course will provide experience in performing experiments to elucidate the structure and function of neurons and neural circuits using classical and cutting-edge techniques. Students will apply these techniques to develop and carry out an independent research project.,"Hinduism is the world’s third-largest religion (or, as some prefer, “way of life”), with about 1.2 billion followers. It is also one of its oldest, with roots dating back at least 3500 years. “Hinduism,” however, is a loosely defined, even contested term, designating the wide variety of beliefs and practices of the majority of the people of South Asia. This survey course introduces students to this great variety, including social structures (such as the caste system), rituals and scriptures, mythologies and epics, philosophies, life practices, politics, poetry, sex, gender, Bollywood, and—lest we forget—some 330 million gods and goddesses.",-0.0022324054,0,0,
RELG 213,ENGL 395.00,"How do religion and medicine approach the healing of disease and distress? Are religion and medicine complementary or do they conflict? Is medicine a more evolved form of religion, shorn of superstition and pseudoscience? This course explores religious and cultural models of health and techniques for achieving it, from ancient Greece to Christian monasteries to modern mindfulness and self-care programs. We will consider ethical quandaries about death, bodily suffering, mental illness, miraculous cures, and individual agency, all the while seeking to avoid simplistic narratives of rationality and irrationality.","Written in 1816 when she was only eighteen years old, Mary Shelley’s brilliant and controversialFrankensteinhas not only lived on but has sparked two centuries’ worth of adaptations, interpretations, and creative re-imaginings, including recent fiction by Saadawi, McGill, and Tsai, an essay on transgender rage by Stryker, episodes ofBlack Mirror, and the novel and filmPoor Things.  We’ll study how several such radical revisions of the novel explore and extend its prescient themes of gender, sexuality, monstrosity, race, the ethics of science, women’s rights, and social justice.",0.3760428,1,0,1
CAMS 214,IDSC 251,"This course is designed to introduce students to recent film history, 1970-present, and the multiple permutations of cinema around the globe. The course charts the development of national cinemas since the 1970s while considering the effects of media consolidation and digital convergence. Moreover, the course examines how global cinemas have reacted to and dealt with the formal influence and economic domination of Hollywood on international audiences. Class lectures, screenings, and discussions will consider how cinema has changed from a primarily national phenomenon to a transnational form in the twenty-first century.Extra Time required for evening Screenings.","Human beings are always and everywhere challenged by the question: What should I do to spend my mortal time well? One way to approach this ultimate challenge is to explore some of the great cultural products of our civilization–works that are a delight to read for their wisdom and artfulness. This series of two-credit courses will explore a philosophical dialogue of Plato in the fall, a work from the Bible in the winter, and a pair of plays by Shakespeare in the spring. The course can be repeated for credit throughout the year and in subsequent years.",0.20896234,0,0,
STAT 285,ASTR 233,"Students will apply their statistical knowledge by analyzing data problems solicited from the Northfield community. Students will also learn basic consulting skills, including communication and ethics.All interested students are encouraged to add to the waitlist and the instructor will reach out after registration. This course is repeatable, but if the instructor cannot admit every student on the waitlist, priority will be given first to Statistics majors who have not previously taken the course and then to other students who have not taken the course.","A study of galactic and extragalactic astronomy with an emphasis on the physical principles underlying the observed phenomena. Topics include the structure and dynamics of the Milky Way Galaxy and other galaxies, the interstellar medium, quasars and active galaxies, clusters and superclusters, and cosmology.",0.29112405,0,0,
