Course_1,Course_2,Description_1,Description_2,Similarity,Markus_Score,Charlie_Score,Tiebreak
ARTS 122,THEA 110,"The ability to build structures that reflect or alter the environment is a basic defining characteristic of our species. In this class we explore creative construction in three dimensions using a variety of media, including plaster, wood, and steel. Using both natural and architectural objects for inspiration, we will examine and manipulate form, space, and expressive content to develop a deeper understanding of this core trait and reawaken our experience of the spaces we inhabit.Sophomore Priority; Three seats held for Art and Art History majors until the first day of sophomore registration.Extra Time Required for field trip","Introduces students to fundamental acting skills, including preliminary physical training, improvisational techniques, and basic scene work. The course includes analysis of plays as bases for performance, with a strong emphasis on characterization.Extra Time for rehearsal",0.624954,1,1,
FREN 259,EDUC 385,"Through literature, cultural texts, and experiential learning in the city, this course will explore the development of both the “Frenchness” and the hybridity that constitute contemporary Paris. Immigrant cultures, notably North African, will also be highlighted. Plays, music, and visits to cultural sites will complement the readings.Requires participation in OCS Program: French and Francophone Studies in Paris",This course permits licensure candidates to become more familiar with their student teaching sites through frequent observation and interaction. The course provides an opportunity to work directly in schools and community organizations related to schools and to reflect on that experience in a classroom setting. Recommended Preparation:Acceptance into Teacher Licensure Program and registration for fall student teaching.Open only to students accepted into Teacher Licensure Program. Extra Time required,0.280362,0,0,
GWSS 398.00,CAMS 214,"This capstone seminar reads representations of racial, gender, and sexual minorities in popular culture through the lenses of feminist, critical race, queer, and trans theories. Kimberlé Crenshaw coined the term “intersectionality” in the late 1980s to describe an approach to oppression that considered how structures of power act multiply on individuals based upon their interlocking racial, class, gender, sexual, and other identities. This seminar takes up the charge of intersectional analysis—rejecting essentialist theories of difference while exploring pluralities—to interpret diversity (or lack thereof) in forms of art and entertainment, focusing on film, TV, and digital media.","This course is designed to introduce students to recent film history, 1970-present, and the multiple permutations of cinema around the globe. The course charts the development of national cinemas since the 1970s while considering the effects of media consolidation and digital convergence. Moreover, the course examines how global cinemas have reacted to and dealt with the formal influence and economic domination of Hollywood on international audiences. Class lectures, screenings, and discussions will consider how cinema has changed from a primarily national phenomenon to a transnational form in the twenty-first century.Extra Time required for evening Screenings.",0.5042768,1,0,1
POSC 266,DGAH 398,"City revenue is increasingly dependent on tourism. Cities manufacture identity and entertainment, whether we think of Las Vegas or Jerusalem, Berlin or Bilbao, the ethnoscapes of Copenhagen or the red light district of Amsterdam. As cities compete in the global economy to become playgrounds for a transnational tourist class, what is the role of urban residents? Who governs? Who benefits? Short essays or exams will be required.","The work of Digital Arts & Humanities takes place at the crossroads of computing, humanities, and creative production. While digital tools and computational methods can enhance humanities research and artistic production, traditional humanistic approaches must also question digital technologies. Both the processes and products of this work stretch the boundaries of familiar academic formats. In this course, students will create an ePortfolio that curates and critically reflects on the digital processes and products of courses and co-curricular experiences at Carleton, guided by readings on the current state of interdisciplinary digital scholarship. A capstone for the DGAH minor, the seminar will include numerous workshop events and culminate in public portfolio presentations. Prerequisite: Prior DGAH coursework, including but not limited to the DGAH core courses.",0.0067919604,0,0,
CHIN 251,MATH 210,"Through generic and historical analysis of the two-millennia long biographical tradition in Chinese historical writing, this project explores lives of heroes and heroines, including, but not limited to: dynastic founders, ministers, generals, poets, assassins, and exceptional women. In this introduction to premodern Chinese culture and literature, students will experience, in English translation, some of the most beautiful works of ancient Chinese literature from the second century BCE through the eighteenth century CE. No prior Chinese language study required.In translation","Vectors, curves, calculus of functions of three independent variables, including directional derivatives and triple integrals, cylindrical and spherical coordinates, line integrals, Green's theorem, sequences and series, power series, Taylor series. This course cannot be substituted for MATH 211.This course cannot be substituted for MATH 211",0.31070814,0,0,
ARBC 103,CAMS 187,"This course sequence introduces non-Arabic speakers to the sounds, script, and basic grammar of Arabic–the language of 200 million speakers in the Arab world and the liturgical language of over a billion Muslims. Students will develop basic listening, speaking, reading and writing skills in Modern Standard Arabic. Classes will incorporate readings and audio-visual material from contemporary Arabic media, as well as popular music.","This course focuses on the history, production, and consumption of cult television. The beginning of the seminar will be focused on critically examining a number of theoretical approaches to the study of genre and fandom. Building on these approaches, the remainder of the course will focus on cult television case studies from the last eight decades. We will draw on recent scholarship to explore how cult television functions textually, industrially, and culturally. Additionally, we will study fan communities on the Internet and consider how fansites, webisodes, and sites like YouTube and Netflix transform television genres.Extra time for evening screenings",0.42303708,0,0,
MUSC 127,FREN 208,"This course examines the causes, methods and logic behind attempts to censor music by governments, commercial corporations and religious authorities through guided listening, reading, and writing assignments. Lectures focus first on the “entartete musik” of Nazi Germany. Contemporary cases of music censorship are then selected from a wide range of countries, including the United States, South Africa, and Russia. The music studied includes that by Pussy Riot, Paul Simon, Pete Seeger, and Richard Wagner.","This course seeks to deepen students’ knowledge of contemporary French culture through a pluridisciplinary approach, using multimedia (books, newspaper and magazine articles, videos, etc.) to generate discussion. It will also promote the practice of both oral and written French through exercises, debates, and oral presentations.Requires participation in OCS Program: French and Francophone Studies in Paris",0.64867264,0,0,
ARTS 322,CLAS 123,"In this intimate and nimble seminar, we will continue our exploration of the many wonders of sculpture, further developing our previous studio-based investigations. During several short and two prolonged problem-based assignments we will work to develop our personal voice and a more nuanced material expression in our art.  We’ll be introducing interior and exterior site-specific installation, casting, advanced woodworking and welding techniques, as well as the potential for interactive robotics and digital media, to the range of possibilities. In Arts 322 you are free to explore the processes that most intrigue you–no specific material or sculptural format will be required.Two seats held for Art and Art History majors until the day after junior priority registration.Extra Time Required","This course explores the archaeology and art of the Ancient Greek world. Beginning with prehistory, we will track the development of the material culture of Ancient Greece through the Classical and Hellenistic periods, and conclude by discussing aspects of the Roman, Byzantine, and Ottoman empires that followed. We will focus throughout on aspects of archaeological practice, material culture and text, art and society, long-term social change, and the role of the past in the present.",0.41593012,1,0,1
GEOL 230,ARBC 103,"Fossils: their anatomy and classification, evolution, and ecology. Special emphasis on the paleobiology of marine invertebrates. Field trips and laboratories included.","This course sequence introduces non-Arabic speakers to the sounds, script, and basic grammar of Arabic–the language of 200 million speakers in the Arab world and the liturgical language of over a billion Muslims. Students will develop basic listening, speaking, reading and writing skills in Modern Standard Arabic. Classes will incorporate readings and audio-visual material from contemporary Arabic media, as well as popular music.",0.5277036,0,0,
MATH 297,MATH 342,"An independent study course intended for students who have completed an external activity related to the mathematics major (for example, an internship or an externship) to communicate (both in written and oral forms) and assess their mathematical learning from that activity.Permission of department chair and homework in advance of the external mathematical activity.","Introduction to algebraic structures, including groups, rings, and fields. Homomorphisms and quotient structures, polynomials, unique factorization. Other topics may include applications such as Burnside’s counting theorem, symmetry groups, polynomial equations, or geometric constructions.",0.5594713,1,0,1
IDSC 289,FREN 210,"This colloquium develops the skills needed to engage in and communicate scientific and mathematical research. Topics will vary each term, but will include searching and reading the primary literature and communicating results orally and via posters. The colloquium will also explore the landscape of academic scientific research and how to negotiate the expectations of being a research group member.Instructor permission required, students should waitlist.","Keep up your French while learning about current issues in France, as well as world issues from a French perspective. Requirements include reading specific sections of leading French newspapers, (Le Monde, Libération, etc.) on the internet, and then meeting once a week to exchange ideas over coffee with a small group of students.Sophomore Priority",0.21429157,0,0,
CS 320,THEA 185,"What does it mean for a machine to learn? Much of modern machine learning focuses on identifying patterns in large datasets and using these patterns to make predictions about the future. Machine learning has impacted a diverse array of applications and fields, from scientific discovery to healthcare to education. In this artificial intelligence-related course, we’ll both explore a variety of machine learning algorithms in different application areas, taking both theoretical and practical perspectives, and discuss impacts and ethical implications of machine learning more broadly. Topics may vary, but typically focus on regression and classification algorithms, including neural networks.","This course seeks to provide a practical understanding of the human voice, its anatomy, functioning and the underlying support mechanisms of body and breath. Using techniques rooted in the work of Berry, Linklater and Rodenburg, the course will explore the development of physical balance and ease and the awareness of the connection between thinking and breathing that will lead to the effortless, powerful and healthy use of the voice in public presentations and in dramatic performance.",0.5031881,1,0,0
CAMS 272,HIST 347,"Narrative films are the product of many artists working in concert toward a shared artistic vision. In this course, students will explore the essential crew roles on narrative films and choose an area in which they would like to specialize during the making of a collaborative project in Los Angeles. In addition to a focus on story and directing actors, specialized equipment and craft labs will expand students' technical skills. Through the term, students will learn the ins-and-outs of filmmaking in Los Angeles while moving through production of a narrative short film, with each student taking on a specific crew position in a collaborative project.Open only to participants in Carleton OCS CAMS Production in Los Angeles Program","In the aftermath of the Second World War and through the 1980s, the United States and the Soviet Union competed for world dominance. This Cold War spawned hot wars, as well as a cultural and economic struggle for influence all over the globe. This course will look at the experience of the Cold War from the perspective of its two main adversaries, the U.S. and USSR, but will also devote considerable attention to South America, Asia, Africa, and the Middle East. Students will write a 20 page paper based on original research.",0.30864024,1,0,0
PSYC 110,CS 361,"This course surveys major topics in psychology. We consider the approaches different psychologists take to describe and explain behavior. We will consider a broad range of topics, including how animals learn and remember contexts and behaviors, how personality develops and influences functioning, how the nervous system is structured and how it supports mental events, how knowledge of the nervous system may inform an understanding of conditions such as schizophrenia, how people acquire, remember and process information, how psychopathology is diagnosed, explained, and treated, how infants and children develop, and how people behave in groups and think about their social environment.","The field of artificial life seeks to understand the dynamics of life by separating them from the substrate of DNA. In this course, we will explore how we can implement the dynamics of life in software to test and generate biological hypotheses, with a particular focus on evolution. Topics will include the basic principles of biological evolution, transferring experimental evolution techniques to computational systems, cellular automata, computational modeling, and digital evolution. All students will be expected to complete and present a term research project recreating and extending recent work in the field of artificial life.",0.63646394,1,0,1
MATH 331,LING 135,"Further topics in analysis such as measure theory, Lebesgue integration or Banach and Hilbert spaces.","There is a complex relationship between language and society. This course examines how language variation is tied to identity and the role of language in human social interaction. We will consider language as it relates to social status, age, gender, ethnicity, and location as well as theoretical models used to study variation. We will also examine how language is used in conversation, in the media, and beyond using ethnography of communication and discourse analysis. You will become more aware of how language is used in your own daily life and will be able to argue sociolinguistic perspectives on language attitudes.",0.3983428,0,0,
FREN 310,MELA 230,"What is scandal? Is it a product of the time and place where it occurs, or can it transcend national and temporal boundaries? This course seeks answers to these questions by examining the texts, films, and artistic productions that caused, exposed, or critiqued a scandal. We will explore topics such as passion, lies, revenge, rumor, and murder. From the Affair of the Poisons during the reign of Louis XIV to controversy over France’s literary prize (the Goncourt), we will analyze the evolution of social norms and public opinions in global French culture from the seventeenth century to the present day.","Judaism emphasizes transmitting memory from one generation to the next. How have pivotal events and experiences in Jewish history lived on in Jewish collective memory? How do they continue to speak through artistic/literary composition and museum/memorial design? How does Jewish collective memory compare with recorded Jewish history? We will study turning points in Jewish history including the Exodus from Egypt, Jewish expulsion from medieval Spain, the Holocaust, and Israeli independence, as Jews in different times and places have interpreted them with lasting influence. Research includes work with print, film, and other visual/ performative media.",0.2775583,0,1,0
HIST 201,CS 251,"Through site visits, on-site projects, and readings, this course explores the ways in which individuals and communities attempted to give physical and visual form to their religious beliefs and political ambitions through their use of materials, iconography, topography, and architecture. We will also examine how the material legacies of imperial Rome, Byzantium, and early Christianity served as both resources for and constraints on the political, cultural, and religious evolution of the Italian peninsula and especially Rome and its environs from late antiquity through the twelfth century. Among the principal themes will be the development of the cult of saints, the development of the papal power and authority, Christianization, reform, pilgrimage, and monasticism.Open only to participants in Carleton OCS Rome Program","What makes a programming language like “Python” or like “Java”? This course will look past superficial properties (like indentation) and into the soul of programming languages. We will explore a variety of topics in programming language construction and design: syntax and semantics, mechanisms for parameter passing, typing, scoping, and control structures. Students will expand their programming experience to include other programming paradigms, including functional languages like Scheme and ML.",0.1953987,0,0,
SPAN 103,RUSS 228F,"This course continues the study of complex sentence patterns and reviews basic patterns in greater depth, partly through the discussion of authentic short stories. Students practice all four skills (reading, writing, listening and speaking) in Spanish. Taught five days a week in Spanish.","This course will offer readings and discussions of Russian-language materials and short speaking and writing assignments. Students taking RUSS 207, 209, 307, and 309 are required to enroll in this supplement to RUSS 228. Taught in Russian.Open only to student participating in Carleton OCS Program: Russophone Studies in Central Asia",0.76206857,1,0,1
PHIL 219,CS 304,"The class is a survey of this distinctly North American tradition, which understands knowing the world as inseparable from exercising one’s agency within it. We will especially focus on the tradition’s directedness towards various dimensions of social improvement and the notion that philosophy is a tool in the realization of an inclusive American democracy. We will start with the readings on how an indigenous philosophical perspective served as a crucial source of American pragmatism, we will then read works of African American Pragmatists as well as “classic” pragmatists and emerging theories such as Black Feminist Pragmatism.","The last decade has seen a vast increase in the number of applications that connect people with one another. This course presents an interdisciplinary introduction to social computing, a field of study that explores how computational techniques and artifacts are used to support and understand social interactions. We will examine a number of socio-technical systems (such as wikis, social media platforms, and citizen science projects), discuss the design principles used to build them, and analyze how they help people mobilize and collaborate with one another. Assignments will involve investigating datasets from online platforms and exploring current research in the field.",0.46428096,1,0,1
ECON 330,POSC 272,An analysis of the forces determining relative prices within the framework of production and distribution. This class is normally taken by juniors. Sophomores considering enrolling should speak to the instructor.,"This course will explore the United States Constitution and the legal doctrines that have emerged from it, using them as lenses through which to understand the history—and shape the future—of this country. Using prominent Supreme Court opinions as teaching tools and loci of debate (including cases on the Court’s recent and current docket), this course will explore the different kind of theoretical approaches with which to make Constitutional arguments and interpret the Constitution. It is one of two paired courses (the other being POSC 271) that complement each other. Both courses will address the structure and functioning of the United States government, and will explore in greater depth the historic Constitutional “trends” towards greater equality and more liberty (albeit slowly, haltingly, and with steps both forward and backward). This course will focus in particular on how gender equality is very much unfinished Constitutional work on our way towards a “more perfect union.” This topic will include an examination of the Court’s recent controversial decision in Dobbs v. Jackson Women’s Health Organization. In exploring matters of personal liberty, this course will focus in particular on First Amendment freedom of speech and other fundamental rights protected under the Fourteenth Amendment’s Due Process Clause. Finally, in examining governmental structures, this course will emphasize the separation of powers across the branches of the federal government. The course will require close reading of judicial opinions and other texts, and learning how to construct arguments using logic and precedent. POSC 271 is not a prerequisite for POSC 272. The two courses can be taken independently, although having taking POSC 271 will provide students with a broader and more nuanced foundation for exploring the themes covered of this course",0.36873117,0,0,
PSYC 257,HIST 347,Students will participate in the planning and replication of empirical studies of the social psychology of social behavior. Requires concurrent registration in Psychology 256. A grade of C- or better must be earned in both Psychology 256 and 257 to satisfy the LS requirement.PSYC 256 required.,"In the aftermath of the Second World War and through the 1980s, the United States and the Soviet Union competed for world dominance. This Cold War spawned hot wars, as well as a cultural and economic struggle for influence all over the globe. This course will look at the experience of the Cold War from the perspective of its two main adversaries, the U.S. and USSR, but will also devote considerable attention to South America, Asia, Africa, and the Middle East. Students will write a 20 page paper based on original research.",0.28873557,-,0,
MUSC 204,FREN 245,"An investigation into the nature of musical sounds and the way they are combined to form rhythms, melodies, harmonies, and form. Topics include the nature of musical pitch, the structure of musical scales and their influence on melody, what gives rise to a sense of tonality, the complexity of rhythmic patterns, and the architecture of musical form. Student work includes building a musical instrument, programming a drum machine, writing computer code to create harmonies and timbres, and an extended music analysis project using empirical methods. Prerequisite: MUSC 101 or permission of instructor as assessed by a diagnostic exam administered at the start of the term.Prerequisite: Music 101, or permission of the instructor as assessed by a diagnostic exam administered at the start of the term","Reading and discussion of literary works, with analysis of social, historical and political issues, with an emphasis on cultural and literary movements such as Négritude (El Negrismo, in Cuba) and their role in shaping ideas of self-determination, Nationalism and Independence in the French colonies of the Caribbean and Black Africa. We will read works by Aimé Césaire (Martinique), Léopold Sédar Senghor (Senegal), Léon Gontran Damas (French Guiana), Jacques Roumain (Haîti), Laye Camara (Guinea), Mongo Béti (Cameroun), Simone Schwartz-Bart (Guadeloupe) and Alain Mabanckou (Congo). Conducted in French.",0.45837492,0,0,
